body,title,url
"Horóscopo de hoy | Martes 1 de diciembre | Tarot | Conoce lo que te deparan las estrellas en el amor y el trabajo, según los signos del zodiaco. Como ya es habitual, compartimos aquí el horóscopo de hoy.MIRA AQUÍ | Coronavirus Perú EN VIVO | Cifras y noticias en el día 261 del estado de emergencia, hoy martes 01 de diciembreEsto es lo que dice tu signo para este martes 1 de diciembre de noviembre de 2020ARIES (marzo 21-abril 20)Trabajo y negocios: llegarán ganancias por negocio que crece. Personas influyentes celebrarán su éxito. Amor: su impulsividad tensará las cosas pero se mostrará irresistible con su pareja.TAURO (abril 21-mayo 20)Trabajo y negocios: datos inquietantes le pondrán en alerta pero tomará medidas para preservarse. Amor: un gesto le tomará de sorpresa pero su corazón sabrá actuar en el momento adecuado.GEMINIS (mayo 21-junio 21)Trabajo y negocios: comprobará que sus posesiones merecen un cuidado especial. Toma riesgos y gana. Amor: deje de lado los ideales para no dispersarse y expresar su ardiente seducción.CANCER (junio 22-julio 22)Trabajo y negocios: descubrirá que alguien de quien se ha burlado vendrá en su ayuda. Comprenderá algo nuevo. Amor: se disipa la tensión en la pareja, la armonía lograda fortalece el romance.LEO (julio 23-agosto 22)Trabajo y negocios: alguien de su entorno está gastando sin control. Con calma, pondrá límites al desborde. Amor: la pareja se enriquecerá con nueva vida social que provocará gratos momentos.VIRGO (agosto 23-septiembre 22)Trabajo y negocios: una sucesión de eventos propicios le hará llevadera la vida y los negocios. Amor: la armonía permitirá a la pareja avanzar hacia una etapa llena de esperanzas.LIBRA (septiembre 23-octubre 22)Trabajo y negocios: sentirá la confianza de sus inicios. Lo que se proponga lo obtendrá fácilmente. Amor: su belleza se mostrará en su apogeo y le predispone para que surja el romance.ESCORPIO (octubre 23-noviembre 21)Trabajo y negocios: el que menos imagina vendrá en su ayuda para resolver una situación difícil. Amor: recuperará el coraje y eso hará que su carisma se perciba irresistible.SAGITARIO (noviembre 22-diciembre 21)Trabajo y negocios: se enfrenta con esa decisión postergada por mucho tiempo. Todo mejora. Amor: recibe sabia sugerencia después de una rencilla y permite la reconciliación.CAPRICORNIO (diciembre 22-enero 20)Trabajo y negocios: buenas noticias; personas influyentes aprueban su labor. Éxitos. Amor: un conflicto se resuelve y llega el tiempo de tomar decisiones maduras en la pareja.ACUARIO (enero 21-febrero 19)Trabajo y negocios: una oportuna llamada evita que tome riesgos o se produzcan pérdidas. Estabilidad. Amor: un romance llamará a su puerta con insistencia. Déle una buena oportunidad.PISCIS (febrero 20-marzo 20)Trabajo y negocios: su alma sensible jugará hoy un papel relevante. Sorprenderá por su habilidad. Amor: su fuerte carisma atraerá a una bellísima persona. Un sueño audaz se cumplirá.–––––––––––––––––––––––––––––––––––––––––SI USTED CUMPLE AÑOS HOY ES UNA PERSONA: IMAGINATIVA Y MUY SENSUAL EN EL AMOR. SE DESVIVE POR COMPLACER A SU PAREJA.VIDEO RECOMENDADO Coronavirus en Perú: Horario del toque de queda será desde las 00:00 hasta las 04:00 horas TE PUEDE INTERESARDe mentes, por Janice SeinfeldMira estos consejos para acabar bien un año escolar atípico5 importantes consejos para combatir la depresiónSalud mental: ¿cómo podemos sanar las heridas que deja esta crisis política en el Perú?", Horóscopo de hoy martes 1 de diciembre: conoce aquí lo que le deparan los astros a tu signo zodiacal ,https://elcomercio.pe/luces/vida-social/horoscopo-2020-todo-lo-que-debes-saber-sobre-tu-signo-zodiacal-este-martes-1-de-diciembre-noticia/
"El chavismo cuenta entre sus candidatos para las elecciones legislativas con rostros más o menos populares y con mayor o menor carisma, pero pone a la cabeza a quienes son seña de identidad indiscutible, figuras que, si bien no reflejan la renovación, siguen contando con apasionados seguidores como si de estrellas del rock se tratasen: Diosdado Cabello y Jorge Rodríguez.MIRA: Tupamaro y Patria Para Todos: los hijos del chavismo contra Nicolás MaduroDIOSDADO CABELLO, EL “SHOWMAN” DEL MAZOPolítico de largo recorrido, Diosdado Cabello, presidente de la Asamblea Constituyente y candidato a las elecciones parlamentarias del 6 de diciembre, a sus 57 años, es uno de los hombres más populares y carismáticos del chavismo, con una capacidad de atraer la atención hacia su persona, que ni sus más acérrimos detractores se atreven a negar.Entre elecciones y amenazas de cárcel, Guaidó busca más sanciones para MaduroUn día con “Nicolasito”, el hijo de Maduro que quiere ser diputado12 claves para entender las atípicas elecciones al Parlamento de Venezuela donde no participa la verdadera oposiciónDe verbo ágil y mente rápida, Cabello no deja indiferente a nadie. Cada miércoles, acapara la atención de millones de venezolanos con su programa Con el Mazo Dando, que se emite en horario de máxima audiencia en el canal público de televisión VTV y en el que el “showman” que lleva dentro del político sale a flote.Los sentimientos que despierta el número dos del chavismo, militar de carrera, son tan dispares como amor u odio, risa o llanto, aplauso o abucheo, loa o crítica, pero la reacción está asegurada. Y él lo sabe. Y lo potencia al extremo.Su dilatada trayectoria política lo avala para presentarse como candidato a cualquier cargo, ya que ha pasado por casi todos, incluida la Presidencia, que ostentó de manera fugaz durante apenas unas horas entre el 13 y el 14 de abril de 2002, después de que se restituyera el orden constitucional tras el golpe de Estado al entonces presidente Hugo Chávez.Le tocó asumir el más alto cargo por mandato constitucional, al ser vicepresidente del Ejecutivo en aquel momento, ya que Chávez se encontraba confinado en la isla venezolana de La Orchila, lo que imposibilitaba su regreso inmediato al mando. Al volver a Caracas, el mandatario retomó el poder de manos de su delfín y fugaz presidente.Esa aventura fue seguida de una larga y fructífera carrera política que continúa a día de hoy y que avanza imparable, una vez más, hacia el Parlamento.Cabello ocupó las carteras de Interior y Justicia, de Obras Públicas y Vivienda, y de Infraestructura. Además, fue director de la Comisión Nacional de Telecomunicaciones (Conatel), presidente del Parlamento, de la Asamblea Nacional Constituyente (ANC) y gobernador del estado de Miranda.Actualmente, aunque no ostenta un cargo en el Ejecutivo de Nicolás Maduro, continúa siendo uno de los hombres más fuertes de la política venezolana, como presidente de la ANC y vicepresidente del Partido Socialista Unido de Venezuela (PSUV), en el poder desde 1999.Su cercanía con Chávez (1999-2013) y su permanencia en la jerarquía del oficialismo le han valido para ser reconocido como “hombre fuerte de la revolución”, distinción de la que ha hecho gala en cada tribuna con que ha contado en las últimas dos décadas.En la otra cara de la moneda, Cabello ha sido acusado de socavar la democracia en Venezuela, razón por la que le han impuesto sanciones económicas desde la Unión Europea, Estados Unidos, Suiza, Canadá, entre otros países y gobiernos.JORGE RODRÍGUEZ, EL LÁTIGO DE LA OPOSICIÓNPoco carismático, aunque apasionado por la política. Escritor de cuentos, amante de la lectura y la poesía, un férreo defensor de la izquierda y del chavismo, Jorge Jesús Rodríguez Gómez se presenta como candidato a diputado con la intención de “rescatar” el Parlamento, dominado por sus adversarios.Con 55 años, cumplidos hace tres semanas, y una vida marcada por el asesinato de su padre, Jorge Antonio Rodríguez -durante un interrogatorio en 1973 por el secuestro de un estadounidense en el que se le implicaba-, el ahora candidato se ha mostrado durante esta campaña con un carácter complaciente en cada discurso.Pero en medio de su afabilidad no pierde oportunidad para señalar y descalificar a los líderes de la oposición, con quienes ha entablado procesos de diálogo en el pasado.Las palabras “ladrones”, “corruptos”, “golpistas” o “terroristas” no faltan en sus alocuciones cuando se trata de hablar sobre sus adversarios, quienes al mismo tiempo lo señalan de crear “novelas” e inventar historias para involucrarlos en crímenes y que sean penados por la justicia.Ha sido el responsable de la organización de las últimas siete campañas electorales del chavismo, pero además fue el encargado de conformar el gobernante Partido Socialista Unido de Venezuela (PSUV) en 2008.Fue hombre de confianza de Chávez y, actualmente, su sucesor, Maduro, le considera “un hermano” al que no duda en felicitar cada vez que el oficialismo obtiene una “victoria” en el escenario político.Rodríguez ha sido una pieza indiscutible en las esferas del chavismo, su nombre es popular desde que entró al Consejo Nacional Electoral (CNE) como rector y presidente del ente entre 2003 y 2006, un cargo que, según sus oponentes, le sirvió para realizar maniobras dentro de la institución en favor del chavismo.A Rodríguez se le acusó en ese momento de intentar retrasar el referéndum revocatorio que se impulsó contra Chávez para que el gobernante no perdiera la contienda, tal y como estimaban los sondeos. El mecanismo se realizó finalmente en 2004.El entonces rector votó en contra de que el CNE aceptara las firmas que había recolectado la oposición para pedir el mecanismo por no haber sido tuteladas por la institución. El antichavismo tuvo que realizar un nuevo proceso de acopio de rúbricas que luego tuvo que pasar por una “validación”, la cual consistía en volver a refrendar.Este mismo proceso se intentó aplicar en 2016 contra Maduro, pero quedó suspendido por una orden del Tribunal Supremo de Justicia (TSJ) y a Rodríguez también se le acusó de tutelar el proceso, pese a no formar parte de la directiva del CNE.Fue vicepresidente ejecutivo de Chávez entre 2007 y 2008, también se desempeñó como alcalde de Caracas entre 2008 y 2017, y como ministro de Comunicación durante el Gobierno de Maduro desde noviembre de 2017 hasta octubre de este año. Conforme a los criterios deSaber más_____________________________VIDEO RECOMENDADOFidel Castro, Hugo Chávez y Nicolás Maduro; las relaciones con el poder de Diego MaradonaFidel Castro, Hugo Chávez y Nicolás Maduro; las relaciones con el poder de Diego Maradona TE PUEDE INTERESARLas implacables y detalladas instrucciones que dejó Enrique VIII de Inglaterra para la decapitación de Ana BolenaBolsonaro minimiza nuevamente la pandemia del coronavirus y pide enfrentarse con “el pecho abierto”Theodore McCarrick, el sacerdote pedófilo que se salió con la suyaJoe Biden agradece “enérgica y obsequiosa” bienvenida mundial tras su triunfo: “Estados Unidos ha vuelto”Biden dice que la negativa de Trump a conceder la derrota es “una vergüenza y no ayudará a su legado”Corte Suprema de EE.UU. insinúa que salvará la reforma sanitaria del Obamacare"," Diosdado Cabello y Jorge Rodríguez, los nombres perpetuos del chavismo que van por la Asamblea Nacional",https://elcomercio.pe/mundo/venezuela/elecciones-venezuela-2020-diosdado-cabello-y-jorge-rodriguez-los-nombres-perpetuos-del-chavismo-nicolas-maduro-perfil-noticia/
"En medio de una crisis en la Policía Nacional del Perú (PNP), los generales PNP (r) Manuel Alberto Pacheco Ledesma y César Guardia Vásquez presentaron hoy sus renuncias a los cargos ante el ministro del Interior, Rubén Vargas Céspedes.MIRA: subcomandante general de la PNP renuncia al cargo en medio de una crisis en la instituciónEn el documento, de fecha 30 de noviembre, Pacheco Ledesma dimite al cargo de director de la Oficina General de Seguridad y Defensa Nacional del Ministerio del Interior, designado mediante la Resolución Ministerial 109-2020-IN.Mientras que Guardia Vásquez -a través del documento de fecha 1 de diciembre- renunció al cargo de director de la Dirección de Control de Drogas y Cultivos Ilegales de la Dirección General Contra el Crimen Organizado, dispuesto a través de la R.M. 903-2020-IN.Ambos generales en retiro de la PNP expresan que el motivo de su decisión es la decisión del ministro del Interior, Rubén Vargas, de pasar al retiro a 18 generales de la PNP y, a consecuencia de ello, el nombramiento a César Cervantes Cárdenas, como nuevo comandante general de la Policía Nacional.“En mi condición de general en situación de retiro de la Policía Nacional del Perú, respetuosamente manifiesto mi desacuerdo por el relevo de alto mando de la PNP, el cual ha contravenido flagrantemente el artículo 8 del D.L. 1267 y el artículo 7 del D.S. 026-2017-IN y sus modificatorias”, remarca la carta de renuncia de Pacheco Ledesma.“Los citados artículos establecen de modo taxativo que el Comandante General de la Policía Nacional del Perú se elige entre los tres Tenientes Generales más antiguos y-en el caso de no haber los Tenientes Generales suficientes- la terna se completa con los generales de mayor antigüedad en el escalafón”, añadió.“La forma como ha actuado su gestión deviene en un quebrantamiento de la meritocracia, institucionalidad y moral de nuestra Policía Nacional del Perú, que siempre se ha encontrado y se encuentra permanentemente en la primera línea de combate ante los flagelos que azotan a nuestra patria”, continúa el documento.Carta de renuncia del general (r) Alberto Pacheco Ledesma. Por su parte, la misiva de renuncia al cargo del general en retiro César Guardia Vásquez expresa el mismo rechazo a la designación de Cervantes como líder de la institución policial. “[…] debo expresar mi total disconformidad por tal decisión dado que con ello se vulnera nuestro marco normativo que se encuentra meridianamente expresado en el Art.8 del D.L. 1267 de la Ley de la Policía Nacional del Perú”, indica.“Esta irregular designación del nuevo Comandante de la PNP motivó el pase inmediato a la situación de retiro de 18 Generales PNP, medida que indudablemente afecta la línea de sucesión de la institucionalidad, la imagen, el prestigio de la institución policial e inclusive a la familia policial”, se lee en el documento.Carta de renuncia del general (r) César Guardia Vásquez. Otra renunciaLas anteriores no son las únicas renuncias. Ayer, el general PNP Edgardo Garrido López, nombrado por el Gobierno de Francisco Sagasti como número dos de la Policía Nacional, presentó su renuncia al cargo ante el comandante general de la PNP, César Cervantes. A través de un escrito, el oficial solicitó pasar a situación de retiro por motivos “estrictamente personales”.Conforme a los criterios deSaber másTE PUEDE INTERESARMininter aclaró que no se desactivará Grupo Terna de la PNP tras expresiones de viceministroGeneral PNP Óscar Gonzales Rabanal presentó su renuncia a la Dirección contra el Crimen Organizado de la PolicíaViceministro del Interior: se investiga a los agentes Terna que participaron en marchas y se sancionará a responsables", PNP: dos generales presentan sus renuncias en rechazo al retiro de 18 de sus colegas del alto mando policial,https://elcomercio.pe/lima/sucesos/policia-nacional-dos-generales-presentan-sus-renuncias-en-rechazo-al-retiro-de-18-de-sus-colegas-del-alto-mando-policial-nndc-noticia/
"Al menos cuatro personas, entre ellas un bebé, murieron este martes en Tréveris (oeste de Alemania) y unas 30 han resultado heridas, algunas de ellas graves, al irrumpir a gran velocidad en una zona peatonal un automóvil, cuyo conductor ha sido detenido, informan medios locales.MIRA: Hombre estrella su carro con pintadas antiglobalización contra la sede del Gobierno de AlemaniaLa policía de Tréveris (Trier en alemán) se ha limitado por el momento a hablar de “varios muertos” y “varios heridos” y ha adelantado que el sospechoso es un hombre de 51 años y nacionalidad alemana. A las 19.00 hora local (17.00 GMT) se celebrará una rueda de prensa en el ayuntamiento.“Están destrozando vidas”: la extrema derecha alemana inaugura un polémico congreso en plena pandemiaAlemania registra 388 muertos por coronavirus y 13.604 nuevos contagios en un díaCómo los mercados de Navidad de Alemania se adaptan a la pandemia de coronavirus | FOTOSLos hechos ocurrieron a primera hora de la tarde en el centro histórico de la ciudad, entre la Basílica de Constantino y la famosa Porta Nigra, cuando un SUV de la marca Range Rover y color gris se lanzó a gran velocidad por una zona peatonal y comercial.Durante varios centenares de metros, según varios testigos, atropelló a transeúntes, algunos de los cuales salieron por los aires, y arrasó puestos de los comercios aledaños. El frontal del vehículo tenía visibles desperfectos.De ahí, el conductor llevó el vehículo hasta una calle adyacente, ya fuera de la zona peatonal, donde fue interceptado por varios vehículos de la policía y fue detenido por agentes. Apenas pasaron cuatro minutos desde el primer aviso hasta el arresto.La policía apuntó que por el momento se desconoce el móvil del sospechoso, aunque varios expertos descartaron en distintos medios alemanes que se trate de un accidente por el largo recorrido que hizo el vehículo por calles peatonales, y coincidieron en juzgar como intencional el múltiple atropello, un extremo que la policía no ha confirmado.El sospechoso, al que varios medios identifican como Bernd W. y que circulaba solo, es vecino de una localidad cercana.“CONMOCIÓN” POLÍTICAEl alcalde de Tréveris, Wolfram Leibe, se mostró conmocionado en unas breves declaraciones ante los medios tras recorrer las calles afectadas, habló de “horror” y confirmó que una de las fallecidas era una menor.La jefa del Gobierno del Land de Renania Palatinado, Malu Dreyer, se refirió a un “día horrible” al visitar a media tarde la ciudad y de “vidas arrancadas” en “un segundo” y destacó especialmente la muerte de “un bebé”. Pidió además apoyo rápido para los damnificados.El portavoz del Gobierno alemán, Steffen Seibert, dijo por su parte que los hechos de Tréveris son “estremecedores” y transmitió su apoyo, de parte de la canciller Angela Merkel, a los familiares de las víctimas y a los heridos.La policía de la localidad alemana apuntó que “no tienen ningún indicio de que el peligro perdure” una vez que se ha practicado la detención del conductor.Toda la zona ha quedado acordonada mientras los investigadores recogen pruebas. Un gran número de agentes se ha desplegado en el centro de la ciudad, algunos de ellos fuertemente armados, mientras un equipo de artificieros ha revisado el vehículo para descartar que hubiese algún artefacto y dos helicópteros sobrevuelan la ciudad.La policía ha pedido a los ciudadanos que eviten en la medida de los posible la zona afectada.Conforme a los criterios deSaber más____________________________VIDEO RECOMENDADOAlemania supera el millón de contagios por coronavirusAlemania supera el millón de contagios por coronavirus (AFP). TE PUEDE INTERESARLas implacables y detalladas instrucciones que dejó Enrique VIII de Inglaterra para la decapitación de Ana BolenaBolsonaro minimiza nuevamente la pandemia del coronavirus y pide enfrentarse con “el pecho abierto”Theodore McCarrick, el sacerdote pedófilo que se salió con la suyaJoe Biden agradece “enérgica y obsequiosa” bienvenida mundial tras su triunfo: “Estados Unidos ha vuelto”Biden dice que la negativa de Trump a conceder la derrota es “una vergüenza y no ayudará a su legado”Corte Suprema de EE.UU. insinúa que salvará la reforma sanitaria del Obamacare", Alemania: conductor embiste con su vehículo a transeúntes en zona peatonal y deja al menos 4 muertos y 30 heridos,https://elcomercio.pe/mundo/europa/alemania-tier-dos-personas-mueren-atropelladas-por-un-auto-en-una-zona-peatonal-del-oeste-del-pais-noticia/
"Conforme a los criterios deSaber másEl expresidente de la República Martín Vizcarra optó por acogerse a su derecho a guardar silencio y no responder a las preguntas de los integrantes de la Comisión de Fiscalización del Parlamento sobre la presunta contratación irregular del cantante Richard Cisneros, conocido como ‘Richard Swing’, en el Ministerio de Cultura durante su mandato (2018-2020). La sesión había sido declarada como reservada.Vizcarra, a su salida de la sede del Congreso, dijo que al día siguiente de haber sido vacado, se presentó, junto a su abogado Fernando Ugaz, ante la Fiscalía de la Nación, que tiene a su cargo la pesquisa del Caso Swing, y ante el despacho del fiscal Germán Juárez Atoche, integrante del equipo especial, que le abrió investigación preliminar por presuntamente recibir sobornos de empresas del “club de la construcción” por dos obras en Moquegua, cuando fue gobernador regional (2011-2014).También dijo que desde que dejó Palacio de Gobierno ha declarado en tres oportunidades ante Juárez Atoche.“Creemos que el órgano que tiene la legalidad y la legitimidad para estas investigaciones es el Ministerio Público y estamos atendiendo todas sus demandas. Por eso, aquí he hecho uso de mi derecho constitucional y legal de guardar silencio, que es una prerrogativa que tiene todo ciudadano”, manifestó.Declaraciones de Martín Vizcarra 01/12/2020 El ex jefe de Estado afirmó que dos congresistas, que forman parte de la Comisión de Fiscalización, lo insultaron.“Con tan solo dos intervenciones de congresistas, ya hemos recibido agravios e insultos, con solo la intervención de dos, nosotros no vamos a estar aquí para verlo”, subrayó.Vizcarra Cornejo también señaló que este Congreso ha recibido el rechazo de la población y la crítica internacional, luego de haber aprobado su destitución.“Esta aventura golpista solo duró seis días porque fue la propia población la que hizo revertir una decisión inconstitucional que se tomó. Entonces, hay esta contradicción entre una institución que respetamos y debemos respetar todos los peruanos y que está actualmente integrada por personas que ya han perdido legitimidad”, expresó.Vizcarra, quien confirmó en los últimos días su intención de postular al Congreso como invitado de Somos Perú, dijo que, si resulta elegido en abril próximo, el primero proyecto que presentará será uno de reforma constitucional para eliminar la inmunidad parlamentaria.Esta es la parte final de la sesión de la Comisión de Fiscalización en la que acuerdan levantar la reserva de la presentación de Vizcarra:“Esta es una clara falta de respeto”El presidente de la Comisión de Fiscalización, Edgar Alarcón, consideró que la decisión de Vizcarra Cornejo de guardar silencio y no responder a ninguna de las preguntas de su grupo investigador es “una clara falta de respeto” al Congreso.“No sé de qué le vale pregonar que es transparente, que no es corrupto, hoy ha dado muestras de lo contrario, lo que ha cometido el señor Vizcarra es una falta de respeto y una obstrucción a la investigación”, manifestó, visiblemente fastidiado.(Foto: Congreso) Alarcón decidió, al inicio de la sesión, que esta se desarrolle de manera reservada.El congresista de UPP también indicó que presentará una denuncia contra Fernando Ugaz, abogado del exmandatario, ante el Colegio de Abogados de Lima (CAL).La Comisión de Fiscalización aprobó, después, levantar la reserva de la parte de la sesión, en la que participó Vizcarra Cornejo.Alarcón: ""Lo que ha cometido Vizcarra es una clara falta de respeto"" Alarcón, en declaraciones a la prensa, indicó que pasarán a Vizcarra Cornejo a condición de investigado.“Le vamos a hacer llegar las preguntas por escrito”, dijo, para luego señalar que cumplirá con el plazo que tienen para presentar su informe final.Agregó que este documento puede concluir con responsabilidad de “tipo constitucional” contra el expresidente.Aclaración: Esta nota fue actualizada con declaraciones de Alarcón a la prensa, tras el final de la sesión de la Comisión de Fiscalización.Te puede interesarMesías Guevara dice que licencia de Merino en Acción Popular no tiene validezYonhy Lescano: ¿su victoria en las internas pondrá fin a la división en Acción Popular?Elecciones 2021: Julio Guzmán, Yonhy Lescano y Nidia Vílchez lideran elecciones internasAcción Popular: Duelo entre los precandidatos presidenciales de cara a las elecciones internasAcción Popular, la revuelta de las bases. Por Fernando VivasAlfredo Barnechea y los otros precandidatos presidenciales que no participarán en la contiendaLas pensiones de los expresidentes en el debate político y legal: ¿Cuántos tienen el beneficio actualmente?Manuel Merino y las imprecisiones de sus recientes declaraciones", Martín Vizcarra guarda silencio ante Congreso: “El que tiene la legitimidad para estas investigaciones es el MP”,https://elcomercio.pe/politica/martin-vizcarra-guarda-silencio-ante-la-comision-de-fiscalizacion-del-congreso-el-que-tiene-la-legitimidad-para-estas-investigaciones-es-el-ministerio-publico-noticia/
