body	category	title	urlConforme a los criterios deSaber másMientras se dirigía al cuarto de vacunación en un hospital de Texas, el médico peruano Gary Gutiérrez Campos no pudo evitar llenarse de alegría. No estaba caminando hacia una inyección cualquiera. Después de 10 meses en primera línea de combate contra el COVID-19 en Estados Unidos, cada paso lo acercaba más a la tranquilidad. La vacuna significaba que, finalmente, podría atender a sus pacientes y abrazar a su hijo con más seguridad, sin ese temor que ha invadido al personal médico de todo el mundo desde el inicio de la pandemia.MIRA: ¿Cómo viven los peruanos en Alemania e Inglaterra el “duro retorno” al confinamiento?El pinchazo llegó para él a las 5 de la tarde del último miércoles. El sábado anterior, el Memorial Hermann Hospital de Houston en el que trabaja como médico internista y hospitalista le había mandado un correo para que se inscribiera en el proceso de vacunación que arrancaría pronto. Cuando fue su turno, el peruano entró en la habitación designada y recibió la dosis del suero de Pfizer y BioNTech. Los doctores a cargo lo observaron por 15 minutos para asegurarse de que no hubiera alguna reacción alérgica inmediata.Coronavirus: Mike Pence se vacuna en público contra el COVID-19 para transmitir confianza | FOTOSDonald Trump afirma que la vacuna de Moderna fue “aprobada de forma aplastante” en Estados Unidos¿Qué países de Latinoamérica ya han aprobado la vacuna de Pfizer y cómo está la pandemia en esas naciones?“Todo salió bien. En ese momento me sentí muy contento y emocionado porque eso era lo que estábamos esperando, que se desarrollara una vacuna eficaz y segura. Apenas recibí el mail me inscribí para ponerme la vacuna. Es un paso importante para vencer al COVID-19”, dijo Gutiérrez a El Comercio unas horas después de recibir la vacuna. Le pondrán la segunda y última dosis dentro de tres semanas.Estados Unidos inició el lunes 14 la primera etapa de un masivo programa de vacunación. Las escasas dosis disponibles del suero de Pfizer y BioNTech –la primera vacuna aprobada en el país norteamericano– están destinadas principalmente para los trabajadores de la salud y los residentes de casas para ancianos.Otro médico peruano que fue vacunado esta semana es el oncólogo Luis Raez, director médico del Memorial Cancer Institute en el Memorial Health Care System, en Miami. Se trata de uno de los hospitales públicos más grandes de Florida y el que más pacientes con coronavirus atiende en ese estado.“Nosotros recibimos varios miles de dosis incluso antes de que la aprobaran. La aprobación se dio el viernes pasado y el lunes empezó la vacunación. El primer día vacunamos casi a 700 médicos y enfermeras y ese ritmo continuó en los días siguientes. Nosotros tenemos miles de médicos y enfermeras. A mí me la pusieron el martes, como a las 9 de la mañana”, cuenta Raez a este Diario.Gary Gutierrez radica en Texas. (Cortesía para El Comercio) En primera líneaPara los doctores Gutiérrez y Raez, el inicio de la vacunación también deja una sensación agridulce cuando piensan en todas las vidas que no se pudieron salvar.“Los primeros meses de la pandemia fueron la parte más dura porque no sabíamos cuán letal era el virus, cuánto iba a durar. Prácticamente se cerraron los hospitales para las cirugías y todo lo electivo”, recuerda Raez.Gutierrez recuerda a los muchos pacientes que fallecieron incluso sin tener problemas médicos previos, también a los que perdieron la vida sin haber llegado a los 40 años.“Junio y julio fueron meses muy difíciles. En Houston los hospitales estaban fuera de capacidad, fue impactante ver a familias sufriendo, ver a esposos morir en cuartos separados. Hubo personas que murieron solas en el hospital porque no se aceptaban visitas. Todo eso fue muy duro. Muchos médicos se quedaron con traumas y cuadros depresivos. También hubo médicos fallecidos”, señala Gutiérrez.Raez agrega que la pandemia ha hecho que todos aprendamos la necesidad de ser más humildes. “Somos más vulnerables de lo que pensábamos como raza humana. Otra enseñanza que nos deja esto es que tenemos que ser más cuidadosos en el futuro, usar mascarillas, mantener el distanciamiento social. Tuvo que pasar esto para tener más cuidado”, comenta.Luis Raez radica en Florida (Cortesía para El Comercio) Generar confianzaEl médico radicado en Texas también enfatiza la importancia de la vacuna para reducir la exposición al virus. Aunque apunta que no se pueden conocer todos los efectos secundarios de las vacunas en este momento, destaca que es la forma más eficiente de hacerle frente a la pandemia a este punto.“Para que se dé la llamada inmunidad de grupo se tiene que contagiar como el 70% u 80% de la población, van a pasar años para que eso se dé. La única forma de protegerse es estar vacunado, entonces a pesar de que hay mucha gente que duda de si se vacuna o no, la verdad es que no hay otra forma de protección. Entonces, como médico había que dar el ejemplo”, afirma Raez al hablar de su propia vacunación.El personal médico de los hospitales en Texas y Florida en los que trabajan nuestros compatriotas está contento con el inicio de la vacunación. Se trata de un paso que, finalmente, les permitirá sentirse más seguros tras varios meses rodeados de COVID-19.“Esta vacuna abre una esperanza, el deseo de todo el personal médico es poder salvar a muchas más personas con la vacuna y la prevención”, dice Gary Gutiérrez.Paciencia y precauciónPero aunque son optimistas, los galenos piden a la población no confiarse. En la misma semana en la que arrancó la mayor campaña de vacunación de la historia de Estados Unidos el número de muertes por coronavirus en el país superó los 3.000 por tres días seguidos. Los decesos totales ya son más de 311.000.Y la situación no pinta bien en el futuro. Con un repunte de contagios y decesos, Estados Unidos está pagando los numerosos viajes y reuniones familiares que se multiplicaron en el país por el Día de Acción de Gracias.“Ahora se está viendo el aumento de casos porque las personas bajaron la guardia y se espera que después de Navidad haya otro rebrote. Ojalá que se haya aprendido la lección con lo que pasó en el Día de Acción de Gracias. Ojalá que los países como Perú vean este mal ejemplo del rebrote y se cuiden. En Navidad la familia es importante y este año se trata de protegerla”, dice Gutiérrez.Raez asegura que pese al inicio de la campaña de vacunación la población aún no se puede confiar pues se trata de un proceso que incluso en Estados Unidos va a tomar bastantes meses.Afirma que la población tiene que darse cuenta de que no la van a vacunar todavía en un buen tiempo. Primero hay que vacunar a los pacientes, médicos, a los bomberos, todo lo cual va a tomar bastante tiempo.“La gente no se va a poder vacunar todavía, hay que tener paciencia y mantener todas las normas. Si Dios quiere, la próxima Navidad será diferente. Pero incluso vacunados y todo, el virus nos ha enseñado que hay que tener mucho cuidado con las enfermedades respiratorias y otras cosas. Vamos a tener que aprender de esto para el futuro. Si alguien está resfriado, se debe usar mascarillas, utilizar gel, lavarse las manos, cosas que antes no nos importaban”, remata Raez.________________VIDEO RECOMENDADOEl presidente de Francia Emmanuel Macron da positivo a COVID-19 TE PUEDE INTERESARGabinete Biden: Los rostros que destacan en el equipo que asumirá en medio de la crisis más grave del siglo [ANÁLISIS]Estados Unidos asegura que tendrá “excedentes” de la vacuna para repartir en el mundoEstados Unidos: Mike Pompeo, en cuarentena por contacto con un enfermo de coronavirusHombre en EE.UU. paga facturas de 114 familias para que no les corten serviciosMéxico aprueba retirar la inmunidad a los agentes de la DEA en el país	Portada	 Los peruanos que ya se vacunaron: la experiencia y las advertencias de dos médicos en EE.UU.	https://elcomercio.pe/mundo/eeuu/coronavirus-estados-unidos-vacuna-pfizer-y-biontech-los-peruanos-que-ya-se-vacunaron-la-experiencia-y-las-advertencias-de-dos-medicos-en-eeuu-noticia/
Estados Unidos está monitorizando la nueva cepa de COVID-19 que está emergiendo en Reino Unido, dijeron el domingo varios altos cargos estadounidenses, agregando que no estaba claro si esta mutación había llegado a Norteamérica.Los peruanos que ya se vacunaron: la experiencia y las advertencias de dos médicos en EE.UU.Las opciones de Biden para castigar el hackeo ruso: sanciones y represalias cibernéticasTrump evaluó invocar la ley marcial para anular las elecciones, según medios“No lo sabemos todavía. Estamos, por supuesto... estudiando esto muy cuidadosamente”, dijo el Dr. Moncef Slaoui, jefe del programa de vacunas COVID-19 de EEUU, al programa “Estado de la Unión” de la cadena CNN.Slaoui, asesor jefe de la administración Trump en la llamada operación “Warp Speed” sobre las vacunas para el COVID-19 y sus tratamientos, añadió que la mutación del Reino Unido es “muy poco probable” que sea resistente a las vacunas actuales, diciendo que: “No podemos excluirla, pero no está ahí ahora”.Conforme a los criterios deSaber másVIDEO RECOMENDADOVacuna contra Covid-19 se empezará a administrar los días 27, 28 y 29 de diciembre en toda Europa TE PUEDE INTERESAREE.UU. supera las 316.000 muertes y los 17,4 millones de casos de coronavirusAMLO y Biden hablan por teléfono sobre agenda México-EE.UU.Biden anuncia a su equipo para luchar contra el cambio climáticoFlorida registra más de 11.000 casos diarios de coronavirusPence se vacuna contra COVID-19 en EE.UU, Biden lo hará el lunes	Portada	 EE.UU. vigila la nueva cepa de coronavirus en Reino Unido e insta a tomar precauciones	https://elcomercio.pe/mundo/eeuu/covid-19-estados-unidos-vigila-la-nueva-cepa-de-coronavirus-en-reino-unido-e-insta-a-tomar-precauciones-vacuna-noticia/
Conforme a los criterios deSaber másEn verano, cuando Manuel Barreto dejó el cargo en la tercera fecha, muchos hinchas veían imposible lo que viven hoy, que Sporting Cristal sea campeón de la Liga 1. Roberto Mosquera llegó para ordenar las cosas en La Florida y los celestes mejoraron de manera notable. Fueron el mejor equipo desde el reinicio del torneo, en la séptima fecha, alzando el trofeo de manera justa.CONTENIDO PARA SUSCRIPTORES: ¿quiénes son los últimos entrenadores en ser bicampeones del fútbol peruano?Basta darle una revisión a la campaña para confirmarlo. En 33 partidos, Sporting Cristal ganó 19, empató 10 y perdió tan solo 4. Es decir, el cuadro bajopontino sumó 67 de 99 posibles, un 67.7% de eficacia. En la etapa regular, además, fue el líder de la tabla acumulada pese a no ganar la Fase 1 ni la Fase 2. Su eficacia fue más allá de quedarse con algún torneo corto.Sporting Cristal no solo resolvió bien las cosas en área contraria, sino también en la propia. Los del Rímac celebraron 61 anotaciones, recibiendo solo 35. El 31 de agosto demostraron su poderío ofensivo al golear por 6-2 a la Academia Cantolao en Matute. Además, en siete encuentros dejó el arco invicto. Emanuel Herrera y Renato Solís destacaron en la delantera y arco, respectivamente.Pese a cambiar de entrenador, Sporting Cristal ha dado la vuelta olímpica. No les sucedía algo parecido desde 2005, año en que Edgardo Bauza dejó el puesto en el Apertura, para que José del Solar entre en su reemplazo. A finales de esa temporada, los celestes superaron a Cienciano en la final jugada en Arequipa. En este caso, los dirigidos por Roberto Mosquera le ganaron a la ‘U’.Campaña de Sporting CristalLiga 1 2020Partidos33Ganados19Empates10Perdidos4Goles a favor61Goles en contra35Amarillas89Rojas8GoleadorEmanuel Herrera (20)Más partidosEmanuel Herrera (32)Roberto Mosquera dirigió a Sporting Cristal en 2012, 2013 y 2020. (Foto: Twitter / @LigaFutProf) - EL PLANTEL -Entre Manuel Barreto (Fechas 1-3), Jorge Soto (Fecha 4) y Roberto Mosquera confiaron en 32 futbolistas, de los cuales jugaron 30. Sporting Cristal contó con el goleador de la Liga 1, Emanuel Herrera con 20. Ya en 2018 había roto el récord de anotaciones en una temporada con 40. Justamente, el argentino es quien más partidos jugó en el equipo.Eso sí, con el paso de la temporada, hasta cinco futbolistas dejaron el equipo por diversos motivos. Pese a que solo llegó el venezolano John Marchán, Roberto Mosquera supo sacarle provecho a su plantel. Es más, no solo a los experimentados sino también juveniles, pues son tres futbolistas celestes quienes actualmente forman parte de la bicolor Sub 20.Incluso, cuando el seleccionado Patricio Álvarez fue dejado de lado, Renato Solís, quien ya estaba tapando previo a la suspensión, asumió su puesto de titular en el arco como un veterano. A sus 22 años, no le pesó jugar en una final. Misma edad tiene el defensor Gianfranco Chávez, el defensor más regular de los rimenses. Martín Távara, un año menor, era el dueño de los balones parados. Sin dudas, se vislumbra un gran futuro en el equipo.Jorge Cazulo cerró la temporada como el gran caudillo de Sporting Cristal, envidiable para cualquier equipo del torneo. El uruguayo nacionalizado peruano fue la gran figura desde el reinicio de la Liga 1. Muchas veces ingresó para cambiarle la cara a sus compañeros y lo consiguió. Anotó uno de los tres goles celestes en la final. Aún medita si retirarse o no luego de su quinto título en nuestro país.Plantel Sporting Cristal campeón de la Liga 1 2020(*): Dejaron el equipo en plena temporada.NªNOMBREPosiciónPJGol1Patricio ÁLVAREZ (*)Arquero2-32Johan MADRIDLateral2803Rafael LUTIGERDefensa104Gianfranco CHÁVEZDefensa3025Omar MERLO (ARG)Defensa3027Horacio CALCATERRAVolante2838Ray SANDOVAL (*)Extremo409Emanuel HERRERA (ARG)Delantero322010Christian ORTÍZ (ARG) (*)Volante1011Washington COROZO (ECU)Extremo28812Renato SOLÍSArquero27-3013Renzo REVOREDODefensa26014Christopher OLIVARESDelantero28815Junior HUERTOLateral8016Jesús CASTILLOVolante18017Christofer GONZALESVolante19518Aryan ROMANÍ (*)Extremo1019José INGAVolante10020Kevin SANDOVALExtremo26421Joao GRIMALDOExtremo1021Jhilmar LOBATÓN (*)Volante2122Carlos CABELLOLateral16023Jorge CAZULOVolante27424Diego SOTOVolante1025Martín TÁVARAVolante28226Emile FRANCOArquero0028Jhon MARCHÁN (VEN)Volante19329Nilson LOYOLALateral25130Percy LIZAVolante10231Benjamín VILLALTADefensa0032Jhilmar LORALateral4035Matías CÓRDOVAArquero00	Portada	 Sporting Cristal se quedó con la Liga 1: los números de un justo campeón	https://elcomercio.pe/deporte-total/sporting-cristal-se-quedo-con-la-liga-1-los-numeros-de-un-justo-campeon-noticia/
"Conforme a los criterios deSaber másCon el cierre de la legislatura encima, el Parlamento aplazó el debate sobre la nueva Ley de Promoción Agraria para este domingo 20 de diciembre. Esto, luego de que, pasadas 11 de la noche de este sábado, las comisiones de Trabajo y de Economía alcanzaran un segundo texto sustitutorio consensuado.Daniel Oseda (Frepap) -quien preside la Comisión de Trabajo del Parlamento- había dirigido el oficio de un primer texto sustitutorio a las 9:15 p.m. a la presidenta Mirtha Vásquez. Luego de leer las modificaciones ante el pleno, fue el turno del presidente de la Comisión de Economía, Anthony Novoa (Acción Popular).“Estamos recogiendo la mayoría de pedidos de la masa trabajadora y, con ello, estamos dándole solución a este problema, que realmente ha sido un daño social, pero consideramos también que ha sido de justicia. Se está haciendo justicia a esta masa trabajadora”, refirió Novoa y acompañó el pedido de Oseda para someter la propuesta al voto del pleno.No obstante, surgieron nuevos reclamos individuales por parte de varios legisladores. Las principales modificaciones al proyecto inicial tenían que ver con el régimen laboral de los trabajadores agroindustriales y agroexportadores, así como con sus condiciones de trabajo. Finalmente, pasadas las 11:20 p.m., se envió un segundo texto sustitutorio.Así se dieron los cambios al proyecto durante la sesión plenaria:PL N° 6826, de la Comisión
Especial Multipartidaria para
la nueva Ley de Promoción AgrariaPrimer texto sustitutorio (9:15 p.m.)Segundo texto sustitutorio (11:28 pm.)Artículo“La remuneración básica agraria está constituida por la Remuneración Mínima Vital (RMV), más una bonificación especial por el tiempo de traslado al centro de trabajo que equivale al 25% de la RMV”.“La remuneración básica está complementada
por el Bono Especial por Trabajo Agrario (BETA), que es equivalente al 25% de la RMV y tiene carácter remunerativo”.“A la RMV se le suma el Bono Especial por Trabajo Agrario (BETA), que es equivalente al 25% de la RMV y tiene carácter remunerativo”.Art. 3, literal C“La CTS equivale a 9.72% de la remuneración básica agraria y las gratificaciones equivalen al 16.66%. El trabajo que exceda por acuerdo mutuo la jornada pactada se paga como horas extras”.“La CTS equivale a 9.72% de la remuneración básica agraria y las gratificaciones equivalen a 16.66%. Estos conceptos se pagan al trabajador de forma prorrateada diariamente o en las fechas que la ley establece. La forma del abono se realiza a elección del trabajador”.“La CTS equivale a 9.72% y las gratificaciones equivalen a 16.66% de la RMV más el Bono Especial por Trabajo Agrario (BETA). Estos conceptos se pagan al trabajador de forma prorrateada diariamente o en las fechas que la ley establece. La forma del abono se realiza a elección del trabajador”.Art. 3, literal D“La remuneración diaria equivale a una remuneración básica agraria, dividida entre 25 [días], que es el número de promedio mensual de días laborables. Sobre esta remuneración, se calcula y paga la CTS y las gratificaciones de fiestas patrias y de Navidad, conforme a sus dispositivos legales”.“La remuneración diaria equivale a una remuneración básica agraria, dividida entre 30 días. Sobre esta remuneración, se calcula y paga la CTS, y las gratificaciones de fiestas patrias y de Navidad, conforme a sus dispositivos legales.“La remuneración diaria equivale a una remuneración básica agraria más el Bono Especial por Trabajo Agrario (BETA), dividida entre 30 días. Sobre esta remuneración, se calcula y paga la CTS, y las gratificaciones de fiestas patrias y de Navidad, conforme a sus dispositivos legales”.Art. 3, literal E“Los trabajadores del sector agroindustrial y agroexportador participan del 5% de las utilidades de sus respectivas empresas, en las condiciones señaladas en el D. Leg. 892, regulan el derecho de los trabajadores a participar en las utilidades de las empresas que desarrollan actividades generadoras de rentas de tercera categoría, y en el reglamento de la presente ley”.“Los trabajadores del sector agroindustrial y agroexportador participan del 10% de las utilidades de sus respectivas empresas, en las condiciones señaladas en el D. Leg. 892, regulan el derecho de los trabajadores a participar en las utilidades de las empresas que desarrollan actividades generadoras de rentas de tercera categoría, y en el reglamento de la presente ley”.Vuelve a la redacción original del PL 6826.Art. 3, literal K“Por acuerdo de las partes, los trabajadores reciben un bono anual de productividad y competitividad cada vez que se produzca el incremento anual del PBI agroindustrial, conforme a las normas que establezca el reglamento”.Se eliminaSigue eliminado.Antes, era el literal L del Art. 3“El pago de la escolaridad cuando corresponda y de acuerdo a la normativa sobre la materia”Se eliminaSigue eliminado.Antes, era el literal P del Art. 3En la tarde del sábado, a pedido del propio Congreso, se presentaron en el pleno el ministro de Economía y Finanzas, Waldo Mendoza, y el ministro de Trabajo y Promoción del Empleo, Javier Palacios. Ambos fueron convocados para exponer sus observaciones sobre el proyecto de la Comisión Especial Multipartidaria que se creó para la formulación de una nueva ley agraria.Mendoza incidió en el tema tributario, señalando que los beneficios tributarios de las empresas agroexportadoras debían reducirse a partir de 2022, con el fin de que se eliminen progresiva y gradualmente hacia 2028. “¿Por qué gradualmente? Porque los años 2020 y 2021 son años complejos para todas las empresas del país”, dijo Mendoza en su exposición.Este punto no fue atendido en ninguna de las modificaciones al proyecto original de la Comisión Especial Multipartidaria, pues el Legislativo insiste en que la reducción -aunque gradual- se inicie desde 2021.Por su parte, Palacios explicó los reparos del Ejecutivo respecto de la elevación de costos laborales y bonificaciones que la propuesta contemplaba.PL N° 6826, de la Comisión Especial Multipartidaria para la nueva Ley de Promoción AgrariaPrimer texto sustitutorioSegundo texto sustitutorioArtículo“La contratación de un trabajador agrario por pequeños plazos que dentro del período de un año superen los dos meses, le da el derecho a ser contratado preferentemente cada vez que el empleador contrata trabajadores”
“Si el trabajador es contratado bajo la modalidad de contratos intermitentes, de temporada o similares, por un mismo empleador, dos veces consecutivas o no consecutivas, tiene preferencia a ser contratado en las siguientes temporadas”
“Si un trabajador agrario labora para varios empleadores bajo contratos estacionales o de temporada, cubriendo un año completo en empresas vinculadas, gana el derecho preferente de ser contratado por las mismas empresas en las siguientes temporadas”
“Las empresas que tienen cultivos diversos cuya estacionalidad conjunta cubre todo el año, si contratan a un trabajador por lo menos dos temporadas en un mismo año, este debe ser contratado preferentemente en las temporadas siguientes”Se suprimió gran parte y se dispuso:
“Establézcase por reglamento las consideraciones para preferencia en la contratación de empleados en función a productividad, estacionalidad, frecuencia, entre otros que el Ministerio de Trabajo considere”Vuelve a la redacción original del PL 6826.Art. 4. literal A“El empleador tiene la obligación de implementar o habilitar:
a) Un servicio de transporte seguro para sus trabajadores de ida y vuelta, que haga posible llegar a sus centros de trabajo y regresar a sus hogares.
b) Comedores para el uso de sus trabajadores, donde proveerá la alimentación correspondiente, según el turno que le toque. El refrigerio es de una hora diaria. 
c) Una posta médica con un médico o una enfermera (o), con todo el equipamiento y los medicamentos necesarios, para otorgar a los trabajadores atención primaria de salud, durante la jornada diaria, en caso sea necesario. 
d) Servicios higiénicos limpios y operativos, diferenciados para hombres y mujeres, para el uso de los trabajadores, los que se encuentran cerca al lugar de prestación efectiva de sus servicios. El reglamento determina la distancia mínima que debe existir entre el lugar de prestación del servicio efectivo y los servicios higiénicos.
e) Surtidores de agua potable para consumo humano de sus trabajadores, durante la jornada laboral. 
f) Proveer a cada uno de los trabajadores de las herramientas individuales, uniformes, equipamiento de protección y seguridad personal, y de bioseguridad, que necesiten para realizar su trabajo, los que no forman parte de sus remuneraciones y no pueden ser descontados de aquellas.Se eliminaban los literales y se disponía:
“El empleador implementa y habilita la infraestructura y personal para dar las facilidades y comodidades para trabajar de forma cómoda y la atención adecuada de eventuales emergencias de acuerdo a lo que se establezca en el reglamento:
El reglamento de la ley fija un cronograma de incorporación de todas las condiciones de trabajo en función a las ventas brutas anuales de los empleadores, el número de sus trabajadores o las hectáreas en producción, entre otros criterios objetivos propios del sector, el que no debe exceder de tres meses a partir de la vigencia de la ley”Vuelve a la redacción original del PL 6826.Art. 5“Los trabajadores agrarios se jubilan a los 55 años de edad, con un mínimo de 10 años de aporte. Pueden optar entre afiliarse al Sistema Privado de Pensiones, al Sistema Nacional de Pensiones o al Sistema Previsional que los reemplace.
Al momento de su jubilación, en el caso de los afiliados al SPP, pueden retirar el 95.5% de los fondos acumulados en su cuenta individual. El 4.5% se traslada a EsSalud para que continúen teniendo ellos y sus derechohabientes la cobertura de salud correspondiente. En el caso de los afiliados al SNP, pueden, excepcionalmente retirar el 100% de sus aportes de la ONP, pasando automáticamente a ser asegurados del SIS, para su cobertura de salud, ellos y sus derecho habientes”.Se elimina todo el artículo sobre jubilación y pensiones.Sigue eliminado.Antes, era el Art. 10El actual periodo de sesiones del Congreso vencía el 18 de diciembre, pero fue ampliado hasta este sábado. Sin embargo, con la frustrada votación de la nueva Ley de Promoción Agraria, la titular de la Mesa Directiva, Mirtha Vásquez, dispuso la suspensión del debate para que se retome este domingo con una ampliación adicional a la legislatura.Este es el segundo texto sustitutorio completo:VIDEO RELACIONADO:Honrar un legado, por Aurelio Arévalo Miró Quesada "	Portada	 Congreso: Los últimos y accidentados cambios al proyecto de la nueva Ley Agraria	https://elcomercio.pe/politica/congreso/congreso-los-ultimos-y-accidentados-cambios-al-proyecto-de-la-nueva-ley-agraria-noticia/
