body	category	title	url
"Conforme a los criterios deSaber másUna norma más que contraviene la Carta Magna fue aprobada por el pleno del Congreso ayer, a pesar de las críticas que recibió de diversos especialistas en los últimos meses y sin considerar las posiciones técnicas de entidades del Ejecutivo. Se trata, pues, de una reforma constitucional que busca establecer que el Estado deba invertir no menos del 6% del PBI año tras año en el sector educación, un propósito que puede sonar bien, pero que en la práctica es inviable.PARA SUSCRIPTORES: Decisiones y consecuencias: la herencia que deja el Congreso este 2020“Estamos de acuerdo en que necesitamos invertir más en educación. Pero decretar que debería ser 6% del PBI no es la solución ni la mejor métrica. Un papel aguanta todo”, remarca Hugo Ñopo, investigador de Grade. Añade que hay otras maneras más relevantes de medir una mayor inversión en Educación, como la inversión educativa por estudiante por año o la inversión educativa como porcentaje del presupuesto público nacional.“Por más que se quiera aumentar la inversión educativa del 3,7% [del PBI] en el que nos encontramos hoy al 6%, de la noche a la mañana no se puede hacer”, detalla Ñopo.Más allá de estos ámbitos que también han sido refutados por el MEF y Minedu, pareciera que de nuevo surge una ley que podría llevar al Ejecutivo y Legislativo a enfrentarse ante el Tribunal Constitucional (TC); y, nuevamente, los expertos apuntan que el Congreso es el que ignora los principios de la Constitución que debería defender.Dos normas fueron declaradas inconstitucionales por el TC: suspensión de peajes y ascensos automáticos en salud. (Ilustración: Giovanni Tazza para El Comercio) Así, en el corto período que tiene, este Parlamento parece estar en camino a batir el récord de leyes declaradas inconstitucionales, luego de que esta semana el TC decidiera –por unanimidad– poner luz roja a la ley de ascensos automáticos en el sector salud. A esta se suman la ley que suspendió el cobro de peajes, declarada inconstitucional; y la norma sobre el retiro de aportes de la ONP, que aún será analizada en el TC.MIRA: AGAP: Nueva propuesta de ley para el agro aumentaría un 60% los costos laborales“Casi todos los proyectos que se están aprobando en el Congreso y se refieren a materia económica tienen, sobre todo, iniciativa de gasto. Son inconstitucionales porque justamente las constituciones tanto de 1979 como de 1993 han querido corregir lo que antes existía en la Constitución de 1933, que era una iniciativa de gasto que distorsionaba las finanzas públicas”, señala Óscar Urviola, expresidente del TC.Urviola remarca que antes de la Constitución de 1979, los congresistas tenían iniciativa en el gasto a través de diversas propuestas congresales, que eran sumas de dinero que se designaba a cada congresista, diputado, o senador, para atender obras en sus respectivas jurisdicciones. “Eso se acabó. Tenía una finalidad política, pero eso generaba un gran desorden no solamente en la priorización de obras de utilidad, sino además en el control mismo de las obras”, precisa.El constitucionalista Aníbal Quiroga, en tanto, resalta que el crecimiento económico no se maneja con una ley, sino a través de los poderes del Ejecutivo, como el Ministerio de Economía y Finanzas (MEF). “Este intento de reforma del 6% del PBI en Educación es absurdo, porque no se puede regular el presupuesto del Estado de esta manera”, detalla.PARA SUSCRIPTORES: Apoyo Consultoría sobre nueva ley agraria: “Si se quiere crear empleo formal, esta no es la manera”“[A este Congreso] no le interesa para nada el tema constitucional ni el económico, sino la imagen que dejan ante el electorado de cara a su futuro en política”, asevera.¿Qué nos espera? Para Alfredo Thorne, exministro de Economía, pareciera que el Congreso “ha tomado el liderazgo de la política económica no para bien, sino para mal”. “No vamos a ver los efectos sino hasta más adelante, a partir del 2022”, comenta.“Creo que los proyectos más duros y donde ha contribuido el Gobierno, para ser sinceros, es en la contrarreforma laboral. Lo estamos viendo ahorita con la Ley de Promoción Agraria. Hemos rigidizado tremendamente nuestro mercado laboral al punto de que queda la duda de si realmente todos estos puestos de trabajo, de subempleo que se están creando ahora, en algún momento se van a convertir en empleos adecuados. Tendería a decir que no”, puntualiza Thorne.Alfredo Thorne, exministro de Economía. (Foto: GEC) El panorama no es positivo, considerando que el Congreso deja una serie de leyes que generarían costos por miles de millones de soles –en el caso de algunas como la de ONP, dependerá del resultado del TC–. Y si llegara a corresponderle al país asumir esa carga financiera, ellos ya no estarán para pagar los platos rotos.SUSCRÍBETE AQUÍ A NUESTRO NEWSLETTER



VIDEO RECOMENDADOPachacámac: empresario es asesinado mientras iba a bordo de su autoPachacámac: empresario es asesinado mientras iba a bordo de su auto TE PUEDE INTERESARBCR: solo medidas populistas frenarían la recuperaciónBanco de la Nación amplía sus horarios de atención en todas sus agencias del paísCompras digitales: ¿Cómo enfrentar un proceso de devolución o cambio de un producto?Centro comercial El Polo logró vender en noviembre el 70% de lo registrado en similar mes del 2019Perú es el tercer país de Latinoamérica con la menor caída en la venta de autosDía del migrante: 88% de hogares venezolanos perdió sus ingresos por la pandemia¿Por qué Alianza Lima lucha tanto para no ir a Segunda División? Aquí las razones económicasNavidad 2020: ¿dónde y cómo comprar un árbol y adornos navideños por internet?"	Portada	 Sin límites en el ámbito económico: El Congreso continúa aprobando normas inconstitucionales [ANÁLISIS]	https://elcomercio.pe/economia/peru/sin-limites-en-el-ambito-economico-el-congreso-continua-aprobando-normas-inconstitucionales-analisis-constitucion-tribunal-constitucional-ejecutivo-noticia/
El Gobierno de Colombia decidió este domingo suspender los vuelos desde y hacia el Reino Unido como medida preventiva ante la detección en ese país de una nueva cepa del coronavirus, informó el presidente Iván Duque.MIRA: Todo lo que debes saber la últimas noticias de Colombia“A partir del día de mañana (lunes), se suspenden los vuelos de Colombia hacia el Reino Unido o del Reino Unido hacia Colombia”, dijo el jefe de Estado en una declaración.“Hay 55 ingresos al día”: El 60% de las camas UCI de París ya están ocupadas por pacientes de coronavirusHospitales en Barcelona se preparan para una segunda ola de ingresos por coronavirus | FOTOSLas calles de París desiertas en la primera noche de toque de queda por el coronavirus | FOTOSLa decisión fue comunicada por Duque al embajador del Reino Unido en Colombia, Colin Martin-Reynolds.Según los científicos británicos, la nueva cepa acelera hasta un 70% más la transmisión del virus y parece responsable del inquietante incremento de los contagios en Londres y varios condados del sureste y el este de Inglaterra.El gobernante colombiano dijo además que cualquier persona que llegue al país a partir del lunes y que haya estado en el Reino Unido en los últimos 14 días “entrará en aislamiento de 14 días en nuestro país”.En ese sentido, Duque añadió que las personas que hayan llegado a Colombia provenientes del Reino Unido en los últimos ocho días “deben también estar en aislamiento durante 14 días”.“Estas personas serán notificadas, conforme a la información migratoria que tenemos, pero aparte de eso, hago un llamado para que las personas de manera clara, al recibir esta información, entiendan la importancia de guardar inmediatamente ese aislamiento por 14 días”, subrayó.Asimismo las personas que hayan estado en el Reino Unido antes de la última semana, es decir, con más de nueve días o 14 días, también van a ser contactadas para hacer seguimiento, con respecto a si presentan alguna situación sintomática.El presidente añadió que la decisión se toma, “para prevenir cualquier aparición de esa nueva cepa en Colombia”.“Lo que se conoce hasta el momento sobre esa mutación es que esa cepa tiene un 70 % de posibilidad de contagio. No obstante, no hay evidencia concluyente de que esa cepa sea mucho más letal, o sea, más agresiva”, dijo Duque.Según el presidente, “estas medidas, de nuevo, son de prevención; no son para generar ni pánico ni generar ninguna situación de preocupación en la ciudadanía. Son medidas de carácter preventivo que se adoptan con responsabilidad y que lo que buscan es ejercer un mejor control epidemiológico”.Conforme a los criterios deSaber más_______________________VIDEO RECOMENDADOOMS se opone a la inmunidad colectiva del coronavirusOMS se opone a la inmunidad colectiva del coronavirus. (AFP). TE PUEDE INTERESAREstuvo desaparecida 12 días en un parque nacional de Estados Unidos y apareció vivaDmitriy Stuzhuk, el influencer que murió por coronavirus después de negar su existenciaLos reveladores detalles de los eventos previos al asesinato del profesor en Francia“Hemos ganado bien y democráticamente”, dice Luis Arce tras su triunfo en BoliviaEstados Unidos felicita a Luis Arce y promete trabajar con él en economía y derechos humanosLo que se sabe del “caso Hunter Biden”, nuevo grito de guerra de los trumpistasQuién es Luis Arce, el cerebro del éxito económico de Bolivia que pavimenta el regreso de Evo Morales [PERFIL]	Portada	 Colombia suspende vuelos con Reino Unido por nueva cepa de coronavirus 	https://elcomercio.pe/mundo/latinoamerica/coronavirus-colombia-en-vivo-casos-y-cifras-oficiales-del-domingo-20-de-diciembre-colombia-suspende-vuelos-con-reino-unido-por-cepa-de-covid-19-nuevo-variante-ultimo-minuto-en-directo-ivan-duque-claudia-lopez-bogota-noticia/
Conforme a los criterios deSaber másEste no será un recuento literario habitual porque no ha sido un año habitual. Significó una etapa muy desfavorable para todos: los autores y las editoriales –en especial las independientes–, las librerías y los lectores. Sin embargo, las letras peruanas no detuvieron su marcha. Nunca dejaron de respirar. Incluso en los meses más duros de la cuarentena me siguieron llegando libros; gran parte fueron remitidos por escritores jóvenes que apostaron por su difusión en medio de una casi absoluta adversidad. Esto no quiere ser un recuento, sino un reconocimiento para quienes resistieron –y nos ayudaron a resistir– a un 2020 que amenazó con transfigurarse en un interminable tiempo muerto y ponzoñoso.PARA SUSCRIPTORES: Lo mejor del 2020: las películas nacionales e internacionales que destacaron, según Sebastián PimentelDebemos admitir que ha sido un año de acertadas reediciones, algunas de ellas reclamadas desde hace mucho por lectores de distintas cofradías. Es el caso de la celebrada “Mañana, las ratas”, del infravalorado José Adolph, que podríamos considerar una novela anticipatoria del ciberpunk. Asimismo, debemos contar a “Una impecable soledad”, uno de los cuadernos más oscuros y densos de Luis Hernández, amparado en una excelente revisión crítica a cargo de Diego García Flores, y el “Diario de mi sentimiento”, del beligerante Alberto Hidalgo, quien hizo del insulto y el agravio armas artísticas con las que ascendió hacia imprevistas cimas. “Ximena de dos caminos”, clásico moderno de Laura Riesco, reapareció con un perspicaz prólogo de Giovanna Pollarolo. Lo mismo sucedió –después de tantos años– con la imperecedera “Redoble por Rancas”, de Manuel Scorza, comentada por Karina Pacheco, y con “Sueños bárbaros”, de Rodrigo Núñez Carvallo, una de las más valiosas novelas peruanas de este siglo. Mención aparte merece el imprescindible rescate de Taller La Balanza, “Materiales para una nueva época”, que recoge, en intachable edición facsimilar, documentos de la primera etapa del movimiento Hora Zero, como la revista inaugural de 1970 y un cuadernillo con las diversas entrevistas que la prensa local dedicó a los jóvenes líderes de aquel vigoroso grupo poético de vanguardia, hoy con medio siglo a cuestas.La no ficción también reunió algunos títulos por destacar. “Señora K”, volumen colectivo destinado a revelar los secretos familiares y políticos de Keiko Fujimori, sorprendió por su consistente elenco de autoras: Valerie Vásquez de Velasco, Mabel Huertas, Ariana Lira y Beatriz Llanos. Alan García fue auscultado en “El código García” por distintos especialistas como Rafaella León, César Hildebrandt, Gabriela Wiener, Marco Sifuentes y Carlos León Moya. “Medio siglo con Borges”, compilación de entrevistas, conferencias y artículos de Mario Vargas Llosa acerca del gran narrador y buen poeta argentino, constituyó una manera idónea de refrescar los acercamientos y lejanías entre dos escritores fundamentales de nuestra lengua. Otros aportes gravitantes fueron “Alias Jorge”, sólida crónica de Ricardo León; “Mitologías velasquistas”, a cargo de Miguel Sánchez Flores; “Causas y azares”, de Luis Rodríguez Pastor; “Mujeres que forjaron el Perú”, de Bruno Polack; “Hijos de la peste”, de Marcel Velázquez Castro; “Escritos selectos”, de Miguelina Acosta Cárdenas (combativa abogada feminista que vale la pena conocer y apreciar); “Afrontar el desastre” de Carmen McEvoy, Alicia del Águila, Jorge Bruce y Ricardo Cuenca; “La batalla por el buen cine”, imperdible antología de las aurorales reseñas cinematográficas de Armando Robles Godoy, seleccionadas por Emilio Bustamante; y “El cine latinoamericano de siglo XXI”, enjundioso estudio de Ricardo Bedoya.No fue un año fecundo para la poesía. Dos voces consagradas acudieron al rescate: Mario Montalbetti entregó una reedición aumentada de “Simio meditando (ante una lata oxidada de aceite de oliva)” y Jorge Pimentel fue homenajeado con una bellísima caja que reúne dos de sus libros canónicos (“Ave soul” y “Tromba de agosto”), a los que se añade un breve poemario inédito, “Necesito ser mundo”, elaborado con el vallejiano e indomable lenguaje de la crueldad.Tres autoras convencieron en el rubro narrativo: Alina Gadea y su “Todo, menos morir” –interesante acercamiento a la sombra de Martín Adán–, Tilsa Otta con el delirante “Lxs niñxs de oro de la alquimia sexual” y Romina Paredes, que en los relatos de “Famulus” sugiere el advenimiento de una propuesta personal y distinta. Igualmente prometedor es “Hijos de la guerra”, conjunto de relatos firmados por Emmanuel Grau. Otro hallazgo de alto impacto es “Ocho cuentos de tampocos y todavías”, editado virtualmente por Enrique Prochazka.Quizá uno de los apartados más activos de este período haya sido el de la literatura infantil y juvenil. Eduardo Recoba coronó a su “El pequeño inca”, amena ensoñación de las aventuras de Túpac Yupanqui. Becky Urbina nos regaló el entrañable “Algo azul”, Mayte Mujica la inteligente ternura de “Cabecita de jardín” y Micaela Chirif a sus “Animales peruanos”. Y aunque fue publicado a finales del 2019, es imposible no inscribir en esta nómina al extraordinario “Migrantes”, de la talentosa Issa Watanabe: algo de luz propicia para un 2020 triste y oscuro.EN RESUMENLa Feria del Libro de Lima celebró su primera edición virtual. Llegó a 3,9 millones de personas y vendió más de 27.000 libros.La nueva Ley del Libro tiene un fondo de S/16 millones para compra de volúmenes, convocatorias de estímulos y otros fines.El Congreso de la Lengua Española, programado para el 2022 en Arequipa, se celebrará con normalidad, según sus organizadores.VIDEO RELACIONADO:Libros recomendados por “Leer para vivir” 17/12/2020 	Portada	 Libros para la resistencia: lo mejor del 2020	https://elcomercio.pe/luces/libros/libros-los-mejores-del-2020-una-seleccion-por-jose-carlos-yrigoyen-balance-noticia/
"Conforme a los criterios deSaber másPese a todas las advertencias que apuntaban a un año de bajas ventas, el sector inmobiliario ha logrado superar el 2020. Indudablemente, el sector sí sufrió un impacto ante los meses de cuarentena obligatoria. Sin embargo, es la rápida recuperación la que ha sorprendido a los gerentes del sector.MIRA: Retiro de Chocotón y Panetoncito de D’Onofrio por moho: ¿qué sucedió y cómo impacta en el consumidor?“Se decía que las ventas de unidades inmobiliarias iban a caer hasta un 20% con la crisis ocasionada por la pandemia, pero al final no fue así. La rápida recuperación ha demostrado la fortaleza del sector”, comenta Ricardo Arbulú, presidente del comité de análisis del mercado de la Asociación de Empresas Inmobiliarias.Claro está que dicho dinamismo responde a diversos factores –tanto de mercado como financieros– que permitieron que los meses de caída en las ventas hayan sido apenas dos.MIRA: ¿Abandono de oficinas?: los sectores empresariales que lideran la desocupación de espacios por el trabajo híbridoPorcentaje de caídaEnero y febrero fueron meses de ventas habituales, pero fue en marzo y abril cuando se sintió la caída de las ventas. En dichos meses, explica Arbulú, las unidades registradas representan las minutas de compraventa firmadas que corresponden a familias que habían separado las viviendas con anterioridad.Luego, en julio, las ventas retomaron sus niveles habituales por encima de las mil unidades mensuales. “Asumiendo que noviembre y diciembre serán similares a lo observado en el año anterior, la venta total alcanzarían las 11.929 unidades en el 2020. Frente a las 13.485 registradas en el 2019, solo representa un retroceso en las ventas de 11,5%”, explica Arbulú.En cifras: el sector inmobiliario en el 2020 (Fuente: ASEI / Infografía: Antonio Tarazona) Si bien el precio en Lima Metropolitana se mantuvo estable, en algunas zonas específicas anotó una reducción. Es el caso de los distritos de San Isidro, Miraflores y demás que conforman Lima Top, donde el precio por metro cuadrado en octubre era 2,7% menor al mismo mes del año previo.Del mismo modo, en Lima Sur, la reducción en el valor fue de 8,6%. Gustavo Ehni, gerente general de Actual Inmobiliaria, explica que son los proyectos ubicados en Chorrillos y zonas de segmento medio donde se vio un mayor dinamismo en la venta. ”Nosotros estamos acostumbrados a una velocidad de venta de 6 a 7 unidades por proyecto al mes. Esto se elevó hasta las 10 unidades”, afirma.MIRA: SBS: ¿Cómo operan las estafas financieras en las redes y cómo debes cuidarte?¿La razón? Además de las facilidades brindadas por la inmobiliaria para la venta de los departamentos se suma la reducción de 10% a 7,5% de la cuota inicial para acceder a los créditos del fondo MiVivienda. ”No muchos lograban tener el ahorro completo del 10%. Que lo reduzcan unos puntos fue vital. Ahora se mantendrá por todo el 2021 y se espera que tenga los mismos resultados”, agrega Ehni.El costo del créditoEl Banco Central de Reserva, en su reciente Reporte de Inflación, detalló que las tasas de interés para los créditos hipotecarios se mantuvieron a la baja.Esta tendencia se mantiene desde hace dos décadas. Mientras que en el 2001 la tasa de interés promedio era de 12,72%, entre enero y noviembre del 2020 esta llegó a 6,45% en promedio. “Las tasas de interés han bajado, pero todavía no reflejan la reducción esperada”, dijo Velarde en reciente conferencia.MIRA: AFP Integra ganó nueva licitación de afiliados y bajará el costo de sus comisionesLa autoridad monetaria también informó que el ahorro privado al tercer trimestre del 2020 alcanzó el 26,4% del PBI, una participación que no se observaba desde 1990. Es por ello que el Banco Central ha presentado medidas apuntando al crédito hipotecario, buscando que dichos ahorros privados puedan canalizarse en gasto.“Básicamente son para promover créditos a más largo plazo, particularmente del crédito hipotecario. Creemos por este nivel de ahorro y los que van a sacar AFP que habrá una masa de recursos que van a querer gastarse”, destacó Velarde el último viernes.En opinión de Antonio Espinosa, gerente general de Inmobiliaria Desarrolladora, dicho impulso podría ser aún más beneficioso para el sector. “Las tasas bajas han motivado la venta de viviendas. Este año empezamos con mucho susto, pero nos está dando gratas sorpresas. Hemos crecido cerca del 10% respecto al año anterior”, comenta a Dia1.MIRA: Ley Agraria: MEF pide al Congreso equilibrio entre bienestar de trabajadores y rentabilidad de empresasTal es el ánimo en el sector que la inmobiliaria ha adquirido cuatro terrenos para el desarrollo de nuevos proyectos.Sin embargo, Espinosa dijo esperar que el próximo año las elecciones no frenen la dinámica de ventas observada en el sector. “Podría afectar un poco. Lo cierto es que la demanda se mantiene constante en la capital”, finalizó.



TE PUEDE INTERESARMoody’s: “Tal vez este Congreso sea una ventana de lo que podría venir [tras las elecciones]” | ENTREVISTAImeco: Economía habría caído alrededor del 4% en octubreEconomía peruana con buenos indicadores para una recuperación en forma de “V”: ¿qué falta?Moody’s: Efectos de la crisis política en Perú sobre la economía han sido más pronunciadosReactivación con grandes proyectos de infraestructura, por Camilo CarrilloMira tambiénVuelos internacionales: Estos son los 25 nuevos destinos que se permitirán desde noviembre "	Portada	 Departamentos en Lima: así se movieron las ventas y precios por distrito durante pandemia | INFORME	https://elcomercio.pe/economia/dia-1/departamentos-en-lima-los-precios-y-la-oferta-disponible-que-dejo-la-venta-del-sector-inmobiliario-en-2020-miraflores-san-isidro-chorrillos-informe-noticia/
"Universidad Católica recibe hoy a Barcelona SC por un duelo clave en la definición del ganador de la etapa y segundo finalista de la LigaPro Serie A. El partido está programado a las 19:00 p.m. (hora peruana) a disputarse en el estadio Olímpico Atahualpa.Alineaciones confirmadasMinuto a minutoMIRA ACÁ: Director Deportivo de Ararat Armenia sobre Jeisson Martínez: "" Si él va las cosas van a ir mejor en ataque en la selección peruana”Barcelona viene de dar un paso firme para llevarse la segunda fase y jugar la final con Liga de Quito tras la goleada 3-0 a Mushuc Runa. Los amarillos se ubican en la cima con 28 puntos, a tres de Emelec, siendo este el único conjunto que le puede arrebatar la condición de primero. Por su parte, Universidad Católica viene igualar 1-1 ante Aucas en condición de visita.REVISA ACÁ: Manchester United vs Leeds EN VIVO: horarios, canales de TV y cómo seguir ONLINE el partido por la Premier LeagueBarcelona vs. Universidad Católica: ¿Dónde Verlo?El partido lo transmite GolTV (658/1658 DirecTV) para Ecuador. Asimismo las incidencias ONLINE y el minuto a minuto del encuentro los podrás seguir en esta misma nota de El Comercio, donde también encontrarás los goles, mejores jugadas y reacciones de los protagonistas de este y otros partidos de las principales ligas del mundo.Barcelona vs. Universidad Católica ¿A qué hora juegan?Ecuador: 19:00Colombia: 19:00Perú: 19:00Argentina: 21:00Chile: 21:00España: 01:00Ciudad de México: 18:00Nueva York: 19:00Conforme a los criterios deSaber másVIDEO RECOMENDADOCanelo Álvarez vs. Callum Smith: la espectacular entrada del mexicano al ring. (Video: DAZN) TE PUEDE INTERESAR:Alianza Lima: ¿es cierto que puede quedarse hasta casi seis meses sin jugar?Fernando Farah, miembro del Fondo Blanquiazul: “Quiero pedirle perdón a Alianza Lima y a sus millones de hinchas”Alianza Lima: Consorcio Fútbol Perú confirmó que transmitirá los partidos de los blanquiazules en la Liga 2Alianza Lima: la historia de cuando los íntimos no jugaron el Descentralizado ‘A’ en 1988"	Portada	 Barcelona SC vs. Universidad Católica EN VIVO: empatan 0-0 partido por la Liga Pro de Ecuador	https://elcomercio.pe/respuestas/via-gol-tv-barcelona-sc-vs-universidad-catolica-en-vivo-fecha-horario-y-canales-de-tv-para-ver-el-partido-por-la-liga-pro-de-ecuador-partidos-de-hoy-futbol-en-vivo-revtli-noticia/
