body	category	title	urlConforme a los criterios deSaber másLa tienda de figuras de acción y juguetes de Bruno Lecca tiene un sillón azul de un cuerpo. Un gran sticker pegado en la puerta del local del Centro Comercial Arenales evidencia que se llama Critteria Coleccionables, pero todos saben que funge, en verdad, de consultorio al que la gente acude por terapia. El hombre de 42 años es uno de los peruanos que más sabe de la historia que envuelve a estas piezas y esa es una virtud que no cualquiera ostenta. Así, puede hablarte con precisión sobre la colección de He- Man que salió en los 80, pero también de la del 2003. De los Thundercats más vendidos. De los Cazafantasmas mejor fabricados. Y también de los últimos lanzamientos de artículos de Deadpool o Thor –con la cara de Chris Hemsworth-. De lo que se viene en mercadería con The Mandalorian. Del pasado y presente, pues, de la fantasía y la cultura popular hecha plástico. De ahí que, más que clientes, ha formado desde hace 13 años una comunidad de amigos que, por turnos, acuden periódicamente a nutrir sus propias antologías articulables, pero, sobre todo a escucharlo. El relato, en su voz y pasión, de cómo dos chicos que estaban aburridos en sus casas terminaron concibiendo las Tortuninjas, relaja. Entretiene. Distrae. Arrulla. Transporta. Sana.         Ver esta publicación en Instagram            Una publicación compartida por CRITTERIA COLECCIONABLES (@critteria_coleccionables) El aprendizaje y el deleite de la experiencia adrenalínica/nostágica/comercial, por supuesto, va de ida y vuelta. Para Bruno, descubrir dónde residen las necesidades emocionales y racionales de quienes visitan la tienda 5-24 es una gran satisfacción para la vocación. Ya sea conversando, viendo una película en la tele que tiene ahí colgada o haciendo en vivos para las cuentas geek de Peruvian Fan Boy – de cuyo equipo forma parte-, el diseñador gráfico de carrera también recarga baterías.         Ver esta publicación en Instagram            Una publicación compartida por Peruvian Fanboy (@peruvianfanboy) “Como toda persona que creció con los padres divorciados, y que además era poco social, me la pasé siempre frente al televisor o en mi cuarto con mis juguetes. Fue muy natural el que eventualmente quisiera dedicarme a algo que tuviera que ver con ellos, cómics, series, dibujos animados, películas. Debo confesar que hubo una época de mi vida que pensé que iba a rendirme frente a la normalidad de una carrera o ir a la oficina. Pero finalmente no sucedió así y estoy feliz por ello”, le cuenta Bruno a Somos. Él estudió diseño gráfico y diseño de interiores, pero luego se daría cuenta que ese no era el camino.MIRA: Navidad: ¿cómo conseguir la imposible Barbie de los 90 que siempre quisiste tener?Su madre, continúa contando, había tenido un stand de juguetes en el Centro Comercial Camino Real. Esto ocurrió en los 80, la época dorada del sitio. Ahí vendía, de contrabando pues, piezas que traía de Estados Unidos, a donde viajaba seguido para visitar a familiares. “Traía las cosas de moda y les sacaba el jugo porque el mercado entonces era reducido. De ella aprendí el teje y maneje del trato con los clientes. Hoy soy muy engreidor con ellos. Me esfuerzo mucho por complacerlos y así somos felices todos”.En Critteria, el emprendedor también compra figuras de acción. La gente que se aburrió de sus colecciones y quiere renovarlas, o simplemente porque necesita dinero, lo busca muchas veces con tesoros valiosos. “Y también reparamos piezas para que estas acompañen todo el tiempo que se pueda a sus dueños. ¡Nuestra especialidad son las articulaciones!”, dice. La pandemia, que lo obligó a cerrar el espacio entre marzo y noviembre, lo hizo enfocarse más en el negocio virtual, y aunque le fue bien en el principio, hoy le es claro que al peruano le gusta más ver in situ para adquirir. “Le damos fuerza a los dos canales, el presencial y el on-line, así todos podemos estar conectados”, afirma.MIRA: DC Fandome: el actor y coleccionista peruano de figuras de acción que será uno de los anfitriones del eventoColección de poetaComo no podía ser de otra manera, Bruno tiene sus propias colecciones. La más grande es la de Transformers, conformada por unas 800 figuras. “A diferencia de otras que tienen un ciclo de vida, esta se renueva cada año desde 1984. Entonces uno tiene que ir a la par”.Unas 800 piezas conforman la colección de Transformers de Bruno Lecca. En la foto, solo una parte de ella. (Foto: Archivo Personal Bruno Lecca) Y, claro, algunas piezas favoritas. Como un portaaviones de los GI Joe que mide 2,30 m. Casi una cama. “Tenerla fue un sueño hecho realidad porque de niño solo era posible ver algo como ella en los avisos de las revistas. Lo compré para la tienda y alguien muy entusiasta se lo llevó. Sin embargo, me pidió que estuviera conservado en mi vitrina porque quería darle un lugar especial en su casa. Así sucedió y él venía a la tienda de cuando en cuando a visitar el portaviones, a conversar, ver tele. Después me confesaría que el motivo real del desprendimiento era que en su hogar ya no cabía un alfiler y que su esposa lo iba a matar. Al final esta regresó a mi poder a crédito de otras tantas figuras. Era el destino porque muchas veces quise quedármelo antes de venderlo. Una vez de nuevo en mi poder, lo llevé a mi casa y ahí está guardado hasta que tenga un local más grande para exhibirlo como se merece”, detalla el ducho. Larga vida a Bruno, comprometido intermediario geek de juguetes y sus dueños. Y, cómo no, también a las representaciones articuladas de la mitología contemporánea que son mucho, pero mucho más, que simples muñequitos.//El portaviones de GI Joe que mide casi como una cama. (Foto: Archivo Personal Bruno Lecca).  VIDEO RELACIONADOJuguetes de ayer y hoy para todos los gustos:Juguetes del ayer y hoy para todos los gustos 	Portada	 De He-Man a The Mandalorian: el coleccionista peruano que puede contar todas las historias detrás de los juguetes 	https://elcomercio.pe/somos/historias/navidad-juguetes-bruno-lecca-el-coleccionista-que-puede-contarte-todas-las-historias-detras-de-los-juguetes-peru-pandemia-noticia/
La Junta Nacional de Justicia (JNJ) publicó este domingo el reglamento de procedimiento de evaluación integral y ratificación de jueces y juezas del Poder Judicial y fiscales del Ministerio Público.Mira: Cuando pueda te vacuno, una crónica de Fernando VivasEl documento, publicado en el boletín Normas Legales del diario oficial El Peruano, establece las disposiciones generales, la información para la evaluación, la participación ciudadana, el procedimiento y expediente, la evaluación, el informe de evaluación, la decisión final, la reconsideración y las disposiciones complementarias, finales y transitorias.En las disposiciones generales se señala que el reglamento tiene por objetivo regular el procedimiento de evaluación integral y la ratificación de los jueces, juezas y fiscales a cargo de la JNJ.“La finalidad del procedimiento de evaluación integral y ratificación es fortalecer y mejorar el sistema de administración de justicia, promoviendo un servicio público de justicia independiente, imparcial, idóneo, predecible, confiable, eficiente, transparente y libre de corrupción; asegurando el mantenimiento de las capacidades y cualidades personales y profesionales que garanticen el correcto ejercicio de las funciones fiscales y judiciales involucrados en tal procedimiento”, indica el reglamento.Se agrega que están sujetos al procedimiento de evaluación integral y ratificación, los jueces y fiscales titulares de todos los niveles del sistema de justicia. “Solo están excluidos aquellos que provienen de elección popular o aquellos sobre quienes, habiendo sido convocados, ha operado alguno de los supuestos de terminación de la carrera”, refiere.Además, establece que la JNJ “solicita información permanentemente a los jueces, juezas y fiscales, así como a las instituciones públicas y privadas y a cualquier otra persona natural o jurídica, sobre los aspectos materia de evaluación, a fin de contar con los elementos necesarios para cumplir sus funciones”.En cuanto a la participación ciudadana, se precisa que pueden informar sobre situaciones de conflicto de interés, entre otras.Finalmente, se elaborará un informe individual y se consignará las calificaciones obtenidas por cada uno de los componentes de la evaluación.“Las conclusiones de dicho informe se publican y son notificadas al juez, jueza o fiscal evaluado. En el caso de los jueces y juezas supremos del Poder Judicial y fiscales supremos del Ministerio Público, la comisión incluirá en el informe el lugar, fecha y hora para la realización de la vista pública”, señala.Por último se, indica también que “el informe oral podrá ser realizado de forma presencial o virtual, bajo el procedimiento regulado en la Directiva respectiva. Los miembros del pleno podrán formular las preguntas que estimen pertinentes. La ciudadanía podrá sugerir preguntas, sin que los miembros del Pleno estén obligados a formularlas, brindando la información señalada en los artículos 30 y 32 del presente reglamento”.Conforme a los criterios deSaber másVIDEO RECOMENDADO:Francisco Sagasti: Veremos cómo implementar ley de ONP, que seguro será declarada inconstitucional 	Portada	 JNJ publica reglamento de procedimiento de evaluación y ratificación de jueces y fiscales	https://elcomercio.pe/politica/justicia/junta-nacional-de-justicia-publica-reglamento-de-procedimiento-de-evaluacion-y-ratificacion-de-jueces-y-fiscales-nndc-noticia/
Conforme a los criterios deSaber más	Portada	 Navidad en Netflix: 10 películas imperdibles para pasar la Nochebuena	https://elcomercio.pe/respuestas/navidad-en-netflix-10-peliculas-imperdibles-para-pasar-la-nochebuena-papa-noel-intercambio-de-princesas-cronicas-de-navidad-noticia/
"Ramalia Vizcarra tuvo su primer encuentro con el ajedrez a los tres años de edad. Sí, a los tres. Fue de la mano de su padre Fred, quien imaginó para ella un tablero de ajedrez tamaño real en su modesta sala. “Hice un cuadro grande en la sala, dibujé el tablero y ella participaba como si fuera la dama, el caballo y el peón”, rescata; como regresando en el tiempo.MIRA TAMBIÉN: La exitosa marca de zapatos peruana que comparte un curioso detalle con Christian LouboutinLa pequeña se fue familiarizando con los movimientos y funciones de cada pieza de esa manera, como si se tratase de un mágico juego creado solo para ella. A los cuatro años, ya estaba lista para participar en torneos locales, en los que consiguió sobrepasar a niños mayores que ella. A los cinco, Ramalia lograba su primer título: Sub campeona categoría sub 7 femenino en el Campeonato Metropolitano del 2016.Pero, ¿de dónde viene aquella chispa? Para entender el talento innato de Ramalia es necesario conocer también la historia de su padre con el ajedrez. Él, se topó con el denominado deporte ciencia ya más adolescente. A los 13 años, para ser exactos. Fue su primo quien le enseñó, a punta de ‘cocachos’, sin esperar que a los seis meses el aprendiz le estaría volteando la partida. “Empecé a ganarle y él ya no quiso jugar conmigo (risas). Ya de más joven me iba a jugar a la Plaza Francia, pero siempre de manera aficionada”, comenta.Ramalia inició en el ajedrez a la corta edad de tres años. (Foto: Kallpa Generación) Muchos años después, fue por su hija que Fred empezó a adquirir libros sobre el deporte, a zambullirse en lecturas infinitas sobre tácticas, aperturas, leyes y normas. A sacar ánimo y confianza cuando en ocasiones faltaban. Siete años después, no ha soltado su mano, y la pequeña promesa acumula ya decenas de títulos a nivel internacional y se posiciona como una de las figuras más valiosas del ajedrez peruano.-BRILLO INTERNACIONAL-En el último Mundial de Ajedrez, FIDE World Youth Rapid Champ - America - U10, llevado a cabo hace apenas unas semanas, Ramalia Vizcarra consiguió dejar en alto el nombre del país, ocupando el octavo lugar de la contienda a nivel panamericano y logrando sobrepasar a varias de sus contrincantes sudamericanas.Este resultado se da luego de un cambio en la modalidad de juego debido a la pandemia, con un giro que ha llevado lo presencial al ámbito virtual: “Todo es por internet. Las enseñanzas también lo son. Felizmente, mi hija se ha adaptado rápidamente a este estilo de juego. Físicamente, las partidas duraban entre una hora y media a dos horas, pero ahora, todo se da en 10 minutos. El competidor tiene que ser más ágil a la hora de pensar, y ella lo ha logrado. Tiene esa virtud. Estoy muy orgulloso”, precisa Fred.""Ramalia merece apoyo del Estado. De esa forma ella practicaría más tranquila este deporte ciencia"", comenta su padre. (Foto: Kallpa Generación) Al último logro, se suman además los ya acumulados en años anteriores, pues Ramalia es Campeona Panamericana de Ajedrez 2020-2019 (título que consiguió en Medellín, Colombia), Campeona Sudamericana de Ajedrez 2020-2019 (título que consiguió en Bs.As. – Argentina), Campeona Nacional de Ajedrez 2020-2019, y, por si fuera poco, también obtuvo 3 títulos FIDE como WCM en el último año, los que la posicionan como candidata a Maestra de Ajedrez.Asimismo, también fue Imagen de la Mujer, homenajeada en el Día Internacional de la Mujer, por el Presidente Martín Vizcarra, La Ministra de la Mujer y la Alcaldesa de SJM. “Del ajedrez, me gustan las aperturas, las tácticas y las estrategias. Me siento feliz, porque he alcanzado ser campeona metropolitana, nacional, sudamericana y panamericana. En el futuro, me gustaría ser ingeniera robótica, además de ser campeona mundial y Gran Maestra”, cuenta Ramalia, con la emoción y timidez de una niña que aún quiere conquistar más del mundo.-Sobre Kallpa Generación-Apoyar el deporte es una de las principales líneas de acción de la gestión social para Kallpa Generación, compañía dedicada a la generación eléctrica. “Conocimos del esfuerzo y potencial de Ramalia y no dudamos en apoyarla; hoy estamos muy orgullosos de acompañar sus triunfos, su dedicación es también una motivación para todos en Kallpa, para seguir trabajando por promover el cambio”, señaló Luis Alburqueque, Gerente de Responsabilidad Social de Kallpa.Conforme a los criterios deSaber másTE PUEDE INTERESAR: Annaiss Yucra deslumbra las pasarelas de Guatemala y revela que recibió un pedido del grupo coreano BlackpinkModa: ¿por qué la diseñadora Carolina Herrera se ha convertido en foco de críticas en Twitter?“Tejedoras por la esperanza”: el proyecto de Genaro Rivas que brinda trabajo a mujeres de SJL“Saqina”, la marca peruana que ofrece cómodas prendas a base de hilado de alpaca"	Portada	 Ramalia Vizcarra: la niña promesa del ajedrez que deja en alto al Perú en torneos internacionales 	https://elcomercio.pe/viu/actitud-viu/ajedrez-ramalia-vizcarra-la-nina-promesa-del-ajedrez-que-deja-en-alto-al-peru-en-torneos-internacionales-noticia/
Conforme a los criterios deSaber másEn la tarde del sábado 28 de noviembre, Alianza Lima (AL) cayó ante Sport Huancayo por dos goles a cero en la última fecha del torneo. Ese fue solo el último empujón para que el club blanquiazul descendiera a la Liga 2 del fútbol peruano en un 2020 para el olvido. Tan solo un año después de haber sido subcampeón de la Liga1.Y hoy, en un nuevo intento dirigencial por quedarse en Primera División, el Fondo Blanquiazul y la Junta de Acreedores han solicitado a la Federación Peruana de Fútbol (FPF) que este año no haya descenso. En esta nota, publicada unos días atrás, explicamos cuán afectadas estás las finanzas del club y cuánto más se afectarían en caso de que se reconfirme el paso de los íntimos a la Liga2.Renato Ricci, country manager del Johan Cruyff Institute Perú, señala que a inicios del 2020 era impensado que AL pudiera descender, debido a que era el club que más facturaba, tenía la plantilla de jugadores más cara, y con mayor taquilla del torneo peruano.Para el experto, el caos en el que se encuentra AL se debe a los malos manejos deportivos que se dieron este año, debido a posibles interferencias de los representantes del Fondo Blanquiazul, principales acreedores del club, en decisiones que no eran de su competencia.MIRA: Alianza Lima: ¿Qué pasará con los sponsors y contratos comercial del club?Como se recuerda, en junio del 2019, el Fondo Blanquiazul pagó el 80% de la deuda concursal que tenía el club con la Sunat, y el total de la deuda con la ONP y la Municipalidad de La Victoria. Así, se convirtió en el principal acreedor, lo cual le otorga la posibilidad de modificar el plan de reestructuración y nombrar nuevos administradores.En ese sentido, Ricci asevera que los acreedores deben limitarse a encargar el trabajo deportivo y administrativo a especialistas, y evitar interferir en sus decisiones.Uno de los errores en el caso de AL, según Ricci, fue contratar jugadores que sufren de constantes lesiones o que tienen un pasado controversial, pagando precios muy elevados por sus pases.Al respecto, Kattia Bohorquez, administradora de AL, señala a Día1 que a inicios del año, alrededor de un 50% de los gastos se destinó a la planilla del primer equipo, lo que suponía un 10% por encima de lo invertido en el 2019.La ejecutiva indica que en lo que respecta a la administración, a inicios de año se escuchó y se decidió apoyar algunas propuestas de los directivos para fortalecer el equipo de mayores con miras a la Copa Libertadores, así como a las divisiones menores. Estos esfuerzos económicos, precisa, no perjudicaban la estabilidad financiera del club. “Nadie sabía que vendría una pandemia que afectarían los planes”, agrega.Los derechos por transmisión en televisión representaron entre el 35% y el 36% del total de los ingresos de Alianza Lima en el 2019. (Foto: Prensa AL) Asimismo, Bohorquez menciona que las apariciones públicas de algunos miembros del Fondo Blanquiazul pronunciándose en los medios dejan cierta evidencia que participaron en las decisiones deportivas.No obstante, Nira Liendo, representante de los acreedores laborales del AL (con casi 21% de la deuda del club), indica que en los documentos que les han entregado se detalla que la inversión en el plantel del primer equipo representa el 77% de los gastos totales. “El año pasado era un 49%”, agrega.Asimismo, Liendo indica que ha recibido información de que el club ha hecho “pagos exorbitantes” por transferencias o a representantes entre abril y septiembre de este año. “Mientras a nosotros (acreedores laborales) nos han negado el pago”, reclama.Tras el descenso, Bohorquez precisa que las decisiones financieras las está tomando a partir de su criterio y el de su equipo de trabajo.DEUDA Y ESCENARIO ADVERSO EN LIGA 2Debido a las dificultades financieras por el COVID-19, Bohorquez refiere que solo se han cumplido con los dos primeros pagos del año. Luego, la administración propuso una modificación en el plan de reestructuración, debido a la crisis por la pandemia y a una nueva deuda concursal por S/7,6 millones que fue reconocida por Indecopi en el 2019 y que no está incluida en el cronograma de pagos.“En las juntas de agosto y de noviembre, los acreedores dejaron en suspenso esta modificación del plan, por lo que estamos pendientes de una próxima convocatoria”, afirma Bohorquez.Al respecto, Liendo precisa que el impacto que les han reportado es de S/4,4 millones y que la Junta de Acreedores les propuso ampliar la deuda por cinco años más, cuando se tenía previsto inicialmente terminar de pagarla en el 2028.“En las juntas de agosto y de noviembre no nos dieron información. Nosotros no podemos votar por algo que no está bien sustentado. Además, no hay coherencia con los números”, subraya.Si bien el 2020 ha sido duro para Alianza Lima, incluso partiendo con un presupuesto de S/56 millones que ha permitido afrontar la pandemia, el 2021 sería aún más complejo por el descenso y su impacto en los ingresos. Esto debido a que en la Liga 2 algunos auspiciadores podrían renegociar contratos.Asimismo, el pago por derechos de transmisión de partidos por TV sería menor en 50%  al que percibía en la Liga1. En efecto, Bohorquez confirma que el contrato contempla esa reducción. “Hasta aquí, tenemos el compromiso total del Consorcio Fútbol Perú de seguir con el club. Ojalá se mantenga el mismo nivel de apoyo en cualquier circunstancia”, comenta. Y, además, no contarán para el 2021 con ningún ingreso por participar en torneos internacionales.INGRESOS EN PANDEMIALa pandemia, además, ha hecho lo suyo erosionando las finanzas del club. La administradora de AL detalla que en el 2020 se dejó de recaudar alrededor de S/6 millones por taquilla, ya que durante casi todo el año se jugó sin público.“En el 2019, Alianza recaudó, entre todas sus competencias, más de S/11 millones [en taquilla], incluyendo torneo local, Copa Libertadores y Noche Blanquiazul”, cuenta Bohorquez, quien detalla que este concepto representó el 19% de los ingresos de la institución.En ese sentido, Eduardo Flores, CEO de la agencia de márketing deportivo Toque Fino, indica que los partidos sin público afectaron, sobre todo, a los clubes grandes. “Solo en un partido de Alianza contra Universitario o Cristal tenían asegurado alrededor de US$350.000”, agrega.En cuanto a los patrocinadores, menciona que todos mantuvieron su apoyo durante el año, “aunque en algunos casos hubo reducciones [en montos] que representaron una merma de algo más de S/2 millones” en los ingresos.Según cifras de la Liga1, Alianza Lima fue el club con más taquilla al registrar una asistencia de 242.244 personas, por un valor de S/5 millones. (Foto: Club Alianza Lima) En tanto, la directiva de Alianza Lima se mueve ahora en otra cancha: tras el fallo a favor de Carlos Stein en la Comisión de Licencias de la FPF, ahora el Fondo Blanquiazul, la gerencia y la Junta de Acreedores han solicitado a la FPF que este año no haya descenso, en una arremetida dirigencial más por mantener al club en Primera. No obstante, en medio de su partido más difícil, al equipo del pueblo se le suma también la pérdida de confianza y rechazo de la hinchada hacia las cabezas de la institución.TE PUEDE INTERESARInversión pública creció 28,4% en noviembre: ¿Cómo fue el desempeño en detalle y qué esperar al cierre del año?Congreso formará grupo de trabajo para evaluar decreto que amplía la Ley de Promoción AgrariaSunafil: “Algunas malas agroexportadoras toman a trabajadores [de services] y no los incorporan a planilla”Paro agrario: ¿Por qué la derogación de la Ley de Promoción Agraria no aseguraría contratos estables?AGAP: la Ley de Promoción Agraria no es el problema, sino las empresas que no la cumplenGratificación: todo lo que debes saber sobre este pago en medio de la pandemia del COVID-19CPL: Alianzas estratégicas entre editoriales y marketplaces ayudan al ecosistema del libroMachu Picchu: PeruRail responde si hubo alza de tarifas y cuándo el turista nacional volverá a usar el tren localNavidad en pandemia: ¿Cómo se está dando el consumo durante la campaña navideña este año?MIRA TAMBIÉN¿Qué países serán los primeros en recibir la vacuna contra el covid-19? 	Portada	 ¿Por qué Alianza Lima lucha tanto para no ir a Segunda División? Aquí las razones económicas	https://elcomercio.pe/economia/dia-1/alianza-lima-cual-es-la-situacion-financiera-del-club-tras-el-descenso-a-la-liga-2-fondo-blanquiazul-junta-de-acreedores-agustin-lozano-fpf-noticia/
