body	category	title	urlConforme a los criterios deSaber másEl 2020 deja como saldo un año de confrontaciones entre el Ejecutivo y el Congreso elegido en enero. Pese a la fragmentación de las bancadas, la relación entre ambos poderes no fue mejor que la que hubo entre el Parlamento de mayoría fujimorista y los gobiernos de Pedro Pablo Kuczynski y Martín Vizcarra. Ambos Congresos han descendido a niveles de aprobación ciudadana que alcanzaron el 10% en sus peores momentos.MIRA: Congreso delega facultades legislativas a la Comisión Permanente hasta el 31 de enero de 2021El politólogo Omar Awapara, director de la carrera de Ciencias Políticas de la UPC, señala que el nivel de consenso entre actores que no comparten nada en común en el Congreso desafía cualquier teoría de acción colectiva. Pese a las decisiones que tomó el Parlamento, para él hay dos puntos importantes para entender la relación del último año.El primero de ellos es que el 30 de setiembre del 2019 significó una oportunidad para que la ciudadanía reevaluara si el Gobierno debía estar en minoría. Pero el Ejecutivo no presentó una lista que compitiera en las elecciones de enero ni sostuvo una alianza con alguna agrupación. Eso, en su momento, no fue criticado y se vio como un gesto de independencia.El segundo punto es la pandemia. Para Awapara, varios de los consensos alcanzados hubieran sido muy difíciles de lograr en otras épocas, especialmente porque la representación estaba atomizada.En marzo, los 130 legisladores electos dos meses antes iniciaron sus labores de una forma inusual, en medio de las restricciones por la pandemia. Si bien la mayoría de congresistas eran inexpertos, fueron tomando protagonismo al aprobar leyes que buscaban acercarse a la ciudadanía. Pero estas generaron confrontaciones que incluso llegaron al Tribunal Constitucional (TC) y produjeron crisis políticas que derivaron en tener tres presidentes en menos de diez días. Algunas de las consecuencias de estas decisiones recién se verán en el futuro cercano.Un rápido acomodoDieciocho días después de su instalación, el 3 de abril, el pleno aprobó dos normas que empezaron a marcar una línea catalogada de populista en un escenario, además, preelectoral. En primer lugar, dieron luz verde a una ley que suspendió el cobro de peajes en vías concesionadas. El Ejecutivo respondió planteando una demanda de inconstitucionalidad, la cual fue acogida por el TC. Luego, aprobaron el retiro del 25% de fondos de las AFP. El gobierno de Martín Vizcarra se opuso aunque sin tomar acciones concretas, pues fue finalmente promulgada por el Legislativo.No fueron pocas las medidas que generaron disputas [en la infografía, los casos más sonados]. Los protagonistas fueron las principales fuerzas políticas: Acción Popular (AP), Unión por el Perú (UPP), Podemos Perú (PP) y Alianza para el Progreso (APP), a las que se sumaron en distintos momentos Frepap, Fuerza Popular (FP) y el Frente Amplio (FA). El Partido Morado (PM) jugó su propio desenlace.Otras iniciativas tuvieron incidencia en el proceso de los comicios generales del 2021. Se dejaron sin efecto las elecciones primarias, lo que dio pie a la realización de unas elecciones internas –a fines de noviembre e inicios de diciembre– en que la gran mayoría de partidos políticos participantes presentó listas únicas de candidaturas presidenciales, con mínima competencia y muy baja participación de los propios militantes. En algunas ocasiones, el Congreso coincidió con el entonces presidente Vizcarra: la reforma constitucional sobre los impedimentos para postular, la ley que reconoce y fomenta el derecho a la lectura, la norma para reprogramar deudas de personas naturales y mypes, el voto de confianza al Gabinete que encabezó Walter Martos tras el rechazo a Pedro Cateriano y la ley que establece un concurso público para la elección de magistrados del TC. Aunque en cuanto a este último punto, se desarrolló un cuestionado proceso, cuya continuidad ha quedado en manos del pleno. La previa del año electoralLos apretones de manos cambiaron por una estocada final a Vizcarra: la vacancia presidencial. Luego de esta decisión, el país vivió días de tensión, incertidumbre y protestas que dejaron dos muertos y decenas de heridos, y que llevaron a la renuncia de Manuel Merino (Acción Popular) a una presidencia en la que estuvo solo cinco días.Ahora, con la presidencia de Francisco Sagasti (Partido Morado) y diversos conflictos aún por resolver, el Congreso cierra su segunda legislatura. La tercera y última comenzará el 1 de febrero, mientras se calienta la campaña electoral rumbo al 11 de abril.La segunda votación necesaria para la eliminación de la inmunidad parlamentaria, la recomposición o desactivación de la comisión especial de selección de miembros del TC o el retorno a la bicameralidad son algunos de los temas pendientes. A ellos se sumarían más iniciativas de orden económico, que se agregarían a otras que ya impactaron negativamente. Sin límites en el ámbito económico(*) Por Paola Villar S.Una norma más que contraviene la Carta Magna fue aprobada por el pleno del Congreso ayer, a pesar de las críticas que recibió de diversos especialistas en los últimos meses y sin considerar las posiciones técnicas de entidades del Ejecutivo. Se trata, pues, de una reforma constitucional que busca establecer que el Estado deba invertir no menos del 6% del PBI año tras año en el sector educación, un propósito que puede sonar bien, pero que en la práctica es inviable.“Estamos de acuerdo en que necesitamos invertir más en educación. Pero decretar que debería ser 6% del PBI no es la solución ni la mejor métrica. Un papel aguanta todo”, remarca Hugo Ñopo, investigador de Grade. Añade que hay otras maneras más relevantes de medir una mayor inversión en Educación, como la inversión educativa por estudiante por año o la inversión educativa como porcentaje del presupuesto público nacional.“Por más que se quiera aumentar la inversión educativa del 3,7% [del PBI] en el que nos encontramos hoy al 6%, de la noche a la mañana no se puede hacer”, detalla Ñopo.Más allá de estos ámbitos que también han sido refutados por el MEF y Minedu, pareciera que de nuevo surge una ley que podría llevar al Ejecutivo y Legislativo a enfrentarse ante el Tribunal Constitucional (TC); y, nuevamente, los expertos apuntan que el Congreso es el que ignora los principios de la Constitución que debería defender.Así, en el corto período que tiene, este Parlamento parece estar en camino a batir el récord de leyes declaradas inconstitucionales, luego de que esta semana el TC decidiera –por unanimidad– poner luz roja a la ley de ascensos automáticos en el sector salud. A esta se suman la ley que suspendió el cobro de peajes, declarada inconstitucional; y la norma sobre el retiro de aportes de la ONP, que aún será analizada en el TC.“Casi todos los proyectos que se están aprobando en el Congreso y se refieren a materia económica tienen, sobre todo, iniciativa de gasto. Son inconstitucionales porque justamente las constituciones tanto de 1979 como de 1993 han querido corregir lo que antes existía en la Constitución de 1933, que era una iniciativa de gasto que distorsionaba las finanzas públicas”, señala Óscar Urviola, expresidente del TC.Urviola remarca que antes de la Constitución de 1979, los congresistas tenían iniciativa en el gasto a través de diversas propuestas congresales, que eran sumas de dinero que se designaba a cada congresista, diputado, o senador, para atender obras en sus respectivas jurisdicciones. “Eso se acabó. Tenía una finalidad política, pero eso generaba un gran desorden no solamente en la priorización de obras de utilidad, sino además en el control mismo de las obras”, precisa.El constitucionalista Aníbal Quiroga, en tanto, resalta que el crecimiento económico no se maneja con una ley, sino a través de los poderes del Ejecutivo, como el Ministerio de Economía y Finanzas (MEF). “Este intento de reforma del 6% del PBI en Educación es absurdo, porque no se puede regular el presupuesto del Estado de esta manera”, detalla.“[A este Congreso] no le interesa para nada el tema constitucional ni el económico, sino la imagen que dejan ante el electorado de cara a su futuro en política”, asevera.¿Qué nos espera? Para Alfredo Thorne, exministro de Economía, pareciera que el Congreso “ha tomado el liderazgo de la política económica no para bien, sino para mal”. “No vamos a ver los efectos sino hasta más adelante, a partir del 2022”, comenta.“Creo que los proyectos más duros y donde ha contribuido el Gobierno, para ser sinceros, es en la contrarreforma laboral. Lo estamos viendo ahorita con la Ley de Promoción Agraria. Hemos rigidizado tremendamente nuestro mercado laboral al punto de que queda la duda de si realmente todos estos puestos de trabajo, de subempleo que se están creando ahora, en algún momento se van a convertir en empleos adecuados. Tendería a decir que no”, puntualiza Thorne.El panorama no es positivo, considerando que el Congreso deja una serie de leyes que generarían costos por miles de millones de soles –en el caso de algunas como la de ONP, dependerá del resultado del TC–. Y si llegara a corresponderle al país asumir esa carga financiera, ellos ya no estarán para pagar los platos rotos.VIDEO RECOMENDADO:Presidente de la Comisión de Transportes asistió a marcha de colectiveros 	Portada	 Decisiones y consecuencias: la herencia que deja el Congreso tras el agitado 2020	https://elcomercio.pe/politica/congreso/lo-que-nos-deja-el-poder-legislativo-este-agitado-ano-de-confrontacion-noticia/
El partido Fuerza Popular solicitó la inscripción de su fórmula presidencial encabezada por Keiko Fujimori para participar de las Elecciones Generales 2021, programadas para el domingo 11 de abril.Mira: Decisiones y consecuencias: la herencia que deja el Congreso tras el agitado 2020En esta lista acompañan a Fujimori Higuchi Luis Galarreta en la primera vicepresidencia y Patricia Juárez en la segunda vicepresidencia.La solicitud fue presentada ante el Jurado Especial Electoral Lima Centro 1, que tiene bajo su jurisdicción la inscripción de los candidatos a la presidencia de la República.Esta es la primera fórmula presidencial en solicitar su inscripción para el proceso del que anunciaron su participación 23 candidatos.Keiko Fujimori postula por tercera vez a la presidencia de la República. También fue candidata en el 2011 y 2016.En su hoja de vida, según la Agencia Andina, consignó sus estudios en administración de empresas con el grado de bachiller por la Boston University y una maestría en Administración de Empresas por Columbia University.Además, en experiencia laboral registra que es presidenta del partido Fuerza Popular y del centro Oportunidades para el Desarrollo y que ejerció funciones como congresista de la República.Según el cronograma electoral del Jurado Nacional de Elecciones (JNE), el martes 22 de diciembre vence el plazo de los partidos para la presentación de sus solicitudes de inscripción de fórmulas y listas de candidatos de cara al próximo proceso electoral.Conforme a los criterios deSaber másVIDEO RECOMENDADO:Robo de vehículos incrementó en diciembre, según la PNP 	Portada	 Elecciones 2021: Fuerza Popular solicita inscripción de fórmula presidencial para participar en comicios	https://elcomercio.pe/elecciones-2021/elecciones-2021-fuerza-popular-solicita-inscripcion-de-formula-presidencial-para-participar-de-comicios-keiko-fujimori-nndc-noticia/
La presidenta del Consejo de Ministros, Violeta Bermúdez, aseguró este domingo que el Perú desde la reapertura de sus fronteras no ha recibido “ni se va a continuar recibiendo” vuelos directos desde el Reino Unido ante la aparición de una nueva cepa del COVID-19 aparecida en dicho país.“En el Perú no hay vuelos directos del Reino Unido. Eso para descartar que estemos recibiendo vuelos y no se han recibido vuelos ni se va a continuar recibiendo [del Reino Unido]. Uno de los temas que hemos visto, también, es tomar medidas más drásticas de prevención y de control a todas las personas que vengan del extranjero”, sostuvo en diálogo con Agenda Política.“Ellos [quienes arriban al Perú desde el extranjero] tienen que presentar el resultado negativo de una prueba molecular, pero además tienen que presentar una declaración jurada. Vamos a poner especial atención. Si alguien hubiera pasado en algún punto por el Reino Unido y vamos a poner especial atención en esos casos”, señaló.En esa línea, la jefa del Gabinete Ministerial aseguró que este lunes habrá una sesión del Consejo de Ministros “para ver qué otras medidas complementarias” tomará el país ante la nueva cepa del COVID-19. Explicó que han coordinado con “países de la región” para tomar decisiones “en conjunto”.“Mañana a primera hora vamos a convocar a un Consejo de Ministros para ver qué otras medidas complementarias vamos a tomar porque hemos estado coordinando con nuestros colegas en los países de América Latina y hay varios que están tomando la decisión de cerrar vuelos internacionales no solo del Reino Unido, sino de otros países”, manifestó.“Vamos a evaluarlo, estamos tratando de tener una decisión conjunta con otros países de la región”, añadió.Más temprano, durante una reunión con gobernadores y autoridades regionales de salud, la ministra de Salud, Pilar Mazzetti, anunció que este lunes el Consejo de Ministros evaluará “replantear algunas de las medidas” adoptadas frente a la pandemia del COVID-19 debido al anuncio de su homólogo del Reino Unido, Matt Hancock, quien indicó que una nueva cepa del coronavirus estaba “fuera de control” en Reino Unido.	Portada	 Bermúdez: No se han recibido ciudadanos de Reino Unido desde reapertura de fronteras 	https://elcomercio.pe/economia/violeta-bermudez-no-se-ha-recibido-ni-se-recibiran-ciudadanos-de-reino-unido-desde-la-reapertura-nndc-noticia/
Conforme a los criterios deSaber másHace 30 años se puso en marcha el modelo económico aún vigente. Su inicio se identifica especialmente con el dramático anuncio de un paquete de medidas por el ministro Juan Carlos Hurtado Miller. El anuncio cerró con las palabras, “qué Dios nos ayude”, frase que quizás le dio un cariz humano al nuevo gobierno de Fujimori y que contribuyó a la aceptación de la dura medicina. Con el tiempo se ha ido formando un veredicto poco cuestionado de ese modelo  –que en lo económico fue un acierto, pero en lo social un retroceso–. Si bien se acepta la realidad de una significativa reducción de la pobreza, se aduce que el modelo habría elevado la desigualdad, agravando las tensiones sociales y amenazando la gobernabilidad. Si bien los cálculos estadísticos de desigualdad tienen mucho de adivinanza, el actual desorden político se considera una confirmación de la crítica al modelo.PARA SUSCRIPTORES: Departamentos en Lima: así se movieron las ventas y precios por distrito durante pandemia | INFORMEPero las encuestas de hogares en todo el país no coinciden con esa crítica. Las familias que más se han levantado durante el régimen del actual modelo económico han sido las más pobres. Si nos fijamos en el decil más pobre de todos los hogares (casi un millón de familias), su ingreso promedio se elevó en 6,2% al año entre el 2001 y el 2019. El siguiente decil en la escala de ingresos, un toque menos pobre, también gozó un fuerte aumento en su ingreso promedio, de 5,4% al año. Por comparación, el ingreso promedio del decil más rico del país gozó una mejora de solo 1,5% al año, y el segundo decil más rico, una mejora de 3,0%. Esas diferencias a favor de los de abajo, acumuladas a lo largo de dos décadas, han significado una importante reducción en la desigualdad.Vista aérea de Pamplona Alta, en el sur de Lima, una zona de alta densidad poblacional que vive en la pobreza. (Foto Cris BOURONCLE / AFP). ¿Cómo es posible que los de abajo se hayan beneficiado mucho más que los de arriba? Habría que buscar esa explicación en las estructuras de la economía. Así, la pobreza extrema se vincula especialmente con dos categorías de trabajador.Una es el trabajador del campo en la Sierra, que depende mayormente de la agricultura. Su pobreza se basa en gran parte en las condiciones físicas de su lugar de trabajo –tierras poco productivas, desgastadas además por un mal aprovechamiento durante siglos, clima incierto, superficie quebrantada, además de enormes distancias entre poblaciones que limitan las posibilidades para la tecnificación y la especialización–. Podría decirse que el pobre rural es el pecado original de la pobreza nacional, y ha sido siempre la categoría más grande y más difícil de socorrer. De allí la conclusión del historiador Carlos Contreras que “las desigualdades en el Perú son el resultado de una geografía también desigual.”Un segundo grupo de pobres es más bien relativamente moderno –el informal urbano– cuya pobreza se explica por la falta de empleo productivo y formal, además de su bajo nivel de educación y otras barreras a un empleo más productivo. En el otro extremo de la distribución de ingresos –los no pobres– encontramos a los trabajadores de empresas formales que se benefician de una alta y creciente productividad.¿Cuál ha sido la evolución de los ingresos de estos tres grupos? Un cálculo es posible desde el año 2007, cuando el INEI empezó a distinguir entre los formales e informales. Sorprendentemente, desde entonces el ingreso promedio de los trabajadores formales de Lima se ha mantenido estancado en términos reales, el de los limeños informales se elevó 1,2 % al año, mientras que el trabajador informal rural de la Sierra vio mejorar su ingreso a una tasa promedio de 3,4 %. Todo indica que la informalidad, sea urbana o rural, no es la barrera absoluta que se cree, aunque falta un mejor entendimiento de sus respectivas dinámicas.Personalmente, no me sorprende el dinamismo estadístico de los más pobres de la Sierra, habiendo visitado diversos distritos en algunas de sus zonas más pobres. En todas, estaban a la vista nuevos negocios y formas de vivir. Pero, ¿por qué el ingreso familiar de los informales de Lima se mejora más que el del formal? Es evidente que hace falta más estudios. Lo que queda claro es que las encuestas familiares contradicen la acusación al modelo iniciado en 1990 de ser un creador de desigualdad. Incluso, la evidencia sugiere lo contrario. Si nos guiamos por los datos disponibles: el modelo económico no solo no agravó la desigualdad sino parecería más bien estar reduciéndola.VIDEO RELACIONADO:SJL: uno de los distritos más golpeados por la informalidad TE PUEDE INTERESAR...Libros para la resistencia: lo mejor del 2020Huir de la oscuridad, por Renato Cisneros¿Qué perfiles laborales buscan los bancos, cajas y financieras y qué nuevas posiciones se están creando?	Portada	 ¿Un modelo antisocial? 	https://elcomercio.pe/opinion/columnistas/un-modelo-antisocial-por-richard-webb-noticia/
Conforme a los criterios deSaber másLa pandemia del nuevo coronavirus (COVID-19) tan solo terminó de poner en jaque a los sistemas democráticos de Latinoamérica y el Caribe, que ya arrastraban cada uno, a su ritmo, sus propios problemas estructurales: la corrupción, la inseguridad, la violencia, la desigualdad y la crisis económica, entre otros. Ahora enfrentan una encrucijada difícil.MIRA: Qué se sabe de la nueva variante de coronavirus detectada en Reino Unido que llevó a la imposición de una dura cuarentena en Londres“La pandemia ha puesto una fuerte presión sobre las democracias en un momento en el que la satisfacción de la gente frente a la democracia ya venía en declive. Llega en un momento no de auge, sino de depresión de la democracia. Y entonces el COVID-19 le añade presión y dificulta el reto que tienen por delante los países”, reflexiona Percy Medina, jefe en Perú del Instituto Internacional para la Democracia y la Asistencia Electoral (IDEA Internacional), en comunicación con El Comercio.La organización ha publicado el “Balance de las tendencias democráticas en América Latina y el Caribe antes y durante la pandemia de la COVID-19”, un análisis sobre el impacto de la pandemia sobre la democracia a lo largo de la región y con el que pone sobre la mesa algunos puntos clave al cumplirse 10 meses desde la aparición del SARS-Cov-2 en esta parte del planeta.Aquí podrán revisar el estudio completo realizado por IDEA:“En muchos países se ha acentuado tendencias autoritarias de desequilibrio entre poderes, se han recortado libertades más allá de lo necesario. Si bien es cierto la gran mayoría ha optado por ‘estados de excepción’ para poder controlar la emergencia sanitaria, y eran razonables, en muchos estos poderes excepcionales han llevado a situaciones de abuso”, remarca Medina.El informe reporta que en todos los países de la región —salvo tres: Cuba, Nicaragua y Trinidad y Tobago— se llegó a declarar un estado de emergencia para contener el COVID-19, convirtiéndola en la región a nivel global “con mayor proporción de países que han utilizado este tipo de instrumento legal”.Y todos lo extendieron “al menos una vez”, se agrega, poniendo la duración promedio en 212 días, “muy por encima del promedio mundial de 154 días”.Ahora bien, el informe apunta también que el 65% de los países de América Latina y el Caribe implementaron medidas para hacer frente a la pandemia “que podrían considerarse preocupantes para la democracia y los derechos humanos”.“No es sorprendente que los regímenes no democráticos de la región (Cuba, Nicaragua y Venezuela) presenten un número de medidas preocupantes para la democracia y los derechos humanos con el fin de combatir la pandemia de la COVID-19 tres veces mayor que las democracias. Sin embargo, para finales de octubre del 2020, más de la mitad de las democracias de la región (12 de 19) también había implementado medidas que presentaban aspectos preocupantes”, se advierte en el documento.Medina subraya que “sería lo normal” que muchas de estas medidas implementadas vayan desapareciendo progresivamente conforme el nuevo coronavirus pierda fuerza en los territorios. Pero acota que en contextos autoritarios o semi autoritarios muchas de ellas se podrían quedar y aprovechar por parte de estos regímenes.“Hay un aprovechamiento de las circunstancias para ganar poder frente a otras entidades del Estado como los parlamentos, por ejemplo. O para aprovechar la emergencia y actuar más libremente. Y eso también en muchos lugares ha dado pie a casos de corrupción, porque se han relajado los controles. […] Denuncias de corrupción hay en muchísimos países”, sostiene Medina.La organización identifica en su informe una serie de “desafíos a la democracia” respecto a gobierno representativo, derechos fundamentales, control del gobierno, administración imparcial y participación.Se hace hincapié, por ejemplo, en que la pandemia alteró el panorama electoral de la región, con casi de la mitad de los comicios aplazados. Ciertamente, un tema elemental para mantener el Estado de derecho. En un inicio, se precisa, se habían programado 25 procesos electorales para el 2020, de los cuales 12 se desarrollaron “según lo planeado”. Otros, en cambio, fueron postergados y finalmente ya se realizaron, mientras que otro grupo está aún pendiente de realizarse.En el tema de derechos fundamentales, se hace mención al uso excesivo de la fuerza policial, tanto para hacer cumplir con las medidas impuestas a raíz del COVID-19 (como el confinamiento), pero también la violencia contra manifestantes.En este apartado se mencionan, por ejemplo, las protestas que desencadenó la vacancia de Martín Vizcarra en Perú y la asunción al poder de Manuel Merino de Lama a mediados de noviembre pasado, que dejó finalmente dos jóvenes muertos: Inti Sotelo y Bryan Pintado.Por otra parte, también se hace referencia a las restricciones y ataques a la libertad de expresión respecto a informaciones relacionadas al manejo de la pandemia, hechos denunciados en Cuba, Venezuela, Argentina, Brasil, El Salvador, Guatemala, Nicaragua y México.TE PUEDE INTERESAR:Cómo la ciencia rastrea el origen del COVID-19 (y por qué es imponte)Brasil supera las 186.000 muertes y los 7,2 millones de casos de coronavirusColombia marca otro récord diario con 13.990 contagios de coronavirusArgentina registra 5.795 nuevos casos de coronavirus en un díaVIDEO RECOMENDADO:Miraflores, el distrito turístico de Lima, sobrevive sin extranjeros 	Portada	 El efecto del COVID-19 en la democracia de América Latina y el Caribe	https://elcomercio.pe/politica/actualidad/informe-el-golpe-del-covid-19-en-la-democracia-de-america-latina-y-el-caribe-nczg-noticia/
