body,title,url"El tipo de cambio en Venezuela registraba una leve subida en la jornada de este martes, en medio de la recta final de cara a los comicios legislativos que se celebrarán el próximo domingo.MIRA AQUÍ | Tipo de cambio: conoce aquí el precio del dólar hoy martes 1 de diciembre de 2020En la apertura, el tipo de cambio se ubicaba a 1′050.374,91 bolívares soberanos, una caída de 15,58% frente a las 1′214.053,74 unidades de la sesión anterior, según el portal DolarToday.El oficialista Partido Socialista Unido de Venezuela (PSUV) comenzó este lunes la recta final para las elecciones del próximo domingo con un gran acto en el sureño estado Bolívar en el que llamó a sus simpatizantes a votar “con disciplina” y en el que no respetaron las medidas para prevenir la covid-19.CONSULTA AQUÍ | Clima en Lima: se espera una temperatura mínima de 16°C, hoy martes 1 de diciembre, según el SenamhiEn el acto tomó la palabra el vicepresidente del PSUV, Diosdado Cabello, quien animó a la multitud congregada “a salir a votar con mucha disciplina” y preguntó a sus simpatizantes si ya saben donde deben acudir para depositar su voto.El considerado como número dos del chavismo llegó al acto entre abrazos de los militantes del PSUV que le jalearon, hablaron a escasos centímetros y palmearon sin respetar ninguna distancia de seguridad. Entre ellos, algunos no llevaban tapabocas.TE PUEDE INTERESAR | Presupuesto 2021: Se deberá “repriorizar el gasto” para atender los 142 proyectos del Congreso, advierte el MEFYa en el estrado, clamó que las elecciones del 6 de diciembre son una venganza contra la oposición que ganó con rotundidad los anteriores comicios de 2015 y que “le hizo daño al país”.Con información de EFEConforme a los criterios deSaber másVIDEO RECOMENDADOAmplían aforo de centros comerciales, Metropolitano, Metro de Lima y taxis 01/12/2020 ", DolarToday Venezuela: ¿a cuánto se cotiza el billete verde HOY martes 1 de diciembre de 2020? ,https://elcomercio.pe/economia/mercados/dolartoday-venezuela-revisa-aqui-el-precio-del-dolar-hoy-martes-1-de-diciembre-dolar-monitor-tipo-de-cambio-usd-a-bolivares-venezolanos-interbanex-nicolas-maduro-coronavirus-covid-19-nndc-noticia/
"Lewis Hamilton dio positivo al coronavirus y no podrá disputar el Gran Premio de Sakhir el domingo, anunciaron este martes su equipo y la Federación Internacional del Automóvil (FIA), y es duda para el cierre de la temporada la próxima semana en Abu Dabi.MIRA: La vuelta de Mike Tyson: el hombre más malo del mundo ha vuelto a sonreír“Se despertó el lunes con ligeros síntomas y al mismo tiempo fue informado de que una persona con la que estuvo en contacto antes de su llegada a Baréin (la semana pasada) dio positivo”, dijo Mercedes en un comunicado.Lewis Hamilton, que se proclamó campeón del mundo por séptima vez a mediados de noviembre, se sometió a un test de diagnóstico y dio positivo. “Se siente bien”, agregó su equipo.“En este momento está aislado”, explicó la FIA en su comunicado oficial, estimando que los procedimientos sanitarios establecidos hacen que su diagnóstico no tenga mayor impacto en la prueba de este fin de semana.De otro lado, el nombre del piloto que reemplazará al británico todavía no ha sido anunciado. Mercedes tiene dos pilotos en reserva: el mexicano Estaban Gutiérrez y el belga Stoffel Vandoorne.Con su título de campeón mundial de 2020, Hamilton alcanzó los siete, un récord que solo comparte con el alemán Michael Schumacher. El pasado domingo el británico se proclamó campeón del Gran Premio de Baréin. El próximo fin de semana se disputa el Gran Premio de Sakhir de Fórmula 1, también en el circuito internacional de Baréin.BREAKING: Lewis Hamilton will miss this weekend's Sakhir Grand Prix in Bahrain after a positive test for Covid-19 pic.twitter.com/c0XCfyDmWZ— Formula 1 (@F1) December 1, 2020 Mercedes precisó que su estrella se sometió a tres test la semana pasada, siguiendo el protocolo en vigor en la F1 y en Baréin, el último el domingo por la tarde. En todos dio negativo.Antes de Hamilton, los dos pilotos de la escudería Racing Point, el mexicano Sergio Pérez y el canadiense Lance Stroll, se perdieron pruebas por el COVID-19.Varias figuras del paddock; como el propietario de Racing Point Lawrence Stroll, el ‘team principal’ de Williams Simon Roberts o el responsable de neumáticos de Pirelli Mario Isola, también dieron positivo desde el comienzo de la temporada en julio.Conforme a los criterios deSaber másMÁS EN DT...F1: Romain Grosjean se salva de la muerte luego de que su vehículo estalle y sea rescatado de las llamas | VIDEOMike Tyson vs. Roy Jones Jr.: ¡15 años después! Revive el último round de ‘Iron Mike’ sobre el ring | VIDEOLionel Messi fuera de la convocatoria para Champions League por segunda vez consecutivaAlejandro Sabella se encuentra delicado de salud tras internamiento“A Diego lo dejaron morir”: Mario Braudry, abogado del hijo de Maradona, realiza grave acusaciónNO DEJES DE VERFútbol Internacional: Lionel Messi y su confesión sobre el homenaje a Maradona | VIDEO ", Lewis Hamilton dio positivo a la prueba del coronavirus y no estará en el Gran Premio de Sakhir,https://elcomercio.pe/deporte-total/polideportivo/lewis-hamilton-dio-positivo-a-la-prueba-del-coronavirus-y-no-estara-en-el-gran-premio-de-sakhir-formula-1-nczd-noticia/
"La empresa estadounidense Pfizer y su socio alemán BioNtech han solicitado ante las autoridades sanitarias europeas la autorización para el uso en la Unión Europea de la vacuna contra el coronavirus que han desarrollado conjuntamente.MIRA: Moderna solicita permiso a Estados Unidos y Europa para comercializar su vacuna contra el COVID-19”Para nosotros como empresa asentada en el corazón de Europa se trata de un hito importante, nos seguiremos esforzando por distribuir la vacuna en todo el mundo tras una posible autorización”, declaró el presidente de BioNtech, Ugur Sahin.En un comunicado conjunto las dos empresas expresaron su esperanza en que la vacuna pueda empezarse a usar en Europa antes del final del año.”En caso de que la EMA (Agencia Europea del Medicamento) llegue a la conclusión de que las ventajas de la vacuna contra el coronavirus son superiores a los posibles riesgos, el organismo recomendará una salida al mercado condicionada”, estiman las empresas en su comunicado sobre la decisión que esperan.Ya hace una semana Pfizer y BioNtech habían solicitado una autorización de urgencia para su vacuna ante las autoridades sanitarias de Estados Unidos, donde el organismo competente (la Administración de Alimentos y Fármacos, FDA, en inglés) se reunirá el 10 de diciembre para decidir sobre la solicitud.La EMA ya ha iniciado un procedimiento especial para acelerar la autorización; en el proceso para obtener esta vía, los fabricantes de vacunas pueden, antes de presentar la solicitud completa, adelantar datos sobre la eficacia de la vacuna y su seguridad en relación con sus efectos secundarios.En caso de que esos datos sean suficientes se puede otorgar una autorización condicionada.La distribución y aplicación de la vacuna implicará un reto logístico ya que tiene que conservarse a una temperatura de menos 70 grados centígrados y para poder garantizarlas Pfizer y BionTech han desarrollado un sistema de transporte con sus propios refrigeradores.MIRA: La vacuna candidata contra el coronavirus de AstraZeneca puede alcanzar una eficacia del 90%La vacuna de Pfizer y BioNtech, en la tercera fase de los estudios clínicos, mostró una efectividad del 95 por ciento y tiene que aplicarse distribuida en dos dosis para que ofrezca protección contra el coronavirus.Antes de conocerse el anuncio de las empresas, la ministra alemana de Investigación, Anja Karliczek, indicó que “se van a necesitar vacunas de distintos laboratorios” y advirtió de que en el proceso de autorización se trata no solo de evaluar su efectividad, sino también de que no presentará efectos secundarios adversos, que serán seguras y accesibles para todo el mundo.Conforme a los criterios deSaber másVIDEO RECOMENDADOCinco millones de peruanos recibirán vacuna de Pfizer en diciembre TE PUEDE INTERESARLa vacuna candidata contra el coronavirus de AstraZeneca puede alcanzar una eficacia del 90%Cómo funciona el bamlanivimab, el primer medicamento diseñado específicamente contra el COVID-19Moderna anuncia que su candidata a vacuna contra el COVID-19 tiene una eficacia de 94,5%Los eventos al aire libre y el riesgo de COVID-19Coronavirus: el misterioso “gen dentro del gen” que descubrieron escondido dentro del SARS-CoV-2COVID-19 | ¿Han funcionado las pruebas rápidas frente a la segunda ola en Italia?Vacuna candidata de Pfizer: el descomunal reto de transportarla y almacenarla a temperaturas ultrafríasCOVID-19 | La importancia de la cadena de frío para las futuras vacunasCOVID-19 | La importancia de la cadena de frío para las futuras vacunas", Pfizer y BioNTech solicitan autorización para su vacuna contra el coronavirus en Europa,https://elcomercio.pe/tecnologia/ciencias/vacuna-contra-covid-19-pfizer-y-biontech-solicitan-autorizacion-para-su-vacuna-contra-el-coronavirus-en-europa-agencia-europea-del-medicamento-ema-nndc-noticia/
"La primera dama de Estados Unidos, Melania Trump, presentó este lunes la decoración navideña de la Casa Blanca, tres meses después de criticar que le tocara desempeñar este papel, aunque esta será la última vez que lo haga después de que su marido, el presidente Donald Trump, perdiera los comicios de noviembre.La primera dama publicó un video en su cuenta de Twitter en el que se la ve admirando la ornamentación colocada en la mansión presidencial, acompañado del mensaje: “Durante esta época especial del año, estoy encantada de compartir ‘America the beautiful’ (Estados Unidos, el bello, el tema de este año en la decoración) y rendir tributo al esplendor de nuestra gran nación”.La republicana Arizona certifica la histórica victoria electoral de Joe BidenWisconsin confirma victoria electoral de BidenEn las próximas semanas habrá disponibles dos vacunas contra el coronavirus en EE.UU., anuncia el gobierno“Juntos celebraremos esta tierra a la que estamos orgullosos de llamar hogar”, indicó Melania Trump.During this special time of the year, I am delighted to share “America the Beautiful” and pay tribute to the majesty of our great Nation. Together, we celebrate this land we are all proud to call home. #WHChristmas pic.twitter.com/fdZmB3rdXL— Melania Trump (@FLOTUS) November 30, 2020 Esta tradición anual incluye este año un recordatorio de la pandemia que está asolando el país.En el video se puede apreciar a la primera dama paseando por las dependencias de la mansión presidencial, donde hay varios árboles navideños con luces blancas y ornamentos rojos.En algunos momentos la imagen muestra pequeños detalles como el tren “Casa Blanca Express” o un motivo decorativo que dice “Be best” (Sé mejor, lema de la iniciativa de la primera dama) o una recreación de un hospital de un pueblo en Navidad, en referencia a los trabajadores sanitarios que luchan contra la pandemia.La decoración de la biblioteca de la Casa Blanca hace referencia al centenario de la ratificación de la 19 enmienda de la Constitución, que se ha cumplido este año y que dio el derecho a las mujeres estadounidenses a votar; mientras que en la llamada Sala Azul se muestra el árbol oficial de Navidad, cuya decoración hace un recorrido por el país desde el punto de vista de los niños.En un comunicado, la Casa Blanca detalló que se pidió a estudiantes de todo EE.UU. que retrataran “lo que hace que sus estados (de procedencia) sean bonitos, destacando la gente, los lugares y las cosas que capturan el espíritu del estado que llaman casa”.En la nota, Melania Trump señaló que en los últimos cuatro años ha tenido el honor de viajar “por algunos de los lugares de referencia más bellos, y conocido a algunos de los ciudadanos estadounidenses más compasivos y patrióticos”.“De costa a costa, el vínculo que todos los estadounidenses comparten es el aprecio por nuestra tradición, valores e historia, que fueron inspiración de la decoración de este año”, indicó la primera dama que deseó felices Navidades, además de un “próspero Año Nuevo con salud”.Hace tres meses hubo una controversia por unos supuestos comentarios que Melania Trump hizo en una conversación grabada en secreto por su exasesora Stephanie Winston Wolkoff, que escribió el libro “Melania and Me”, y que salieron a la luz en medios de comunicación.En las grabaciones, Melania Trump expresó presuntamente su desaliento por su papel en la decoración navideña de la Casa Blanca y al mismo tiempo por ser criticada por no desempeñar un rol más significativo como primera dama.“Me estoy matando a trabajar en el tema de Navidad, que, sabes, ¿a quién le importa un carajo las cosas de Navidad y las decoraciones? Pero tengo que hacerlo, ¿Verdad?”, dijo presuntamente la primera dama en una de las grabaciones hechas por su examiga.“Y luego -siguió-, lo hago, y digo que estoy trabajando sobre la Navidad y estoy planificando la Navidad, y dicen ‘¿Y qué sobre los menores separados (los menores migrantes separados de sus familiares)?’ Denme un maldito respiro”.En su día, la jefa de gabinete de la primera dama, Stephanie Grisham, criticó a Wolkoff y afirmó que no había manera de saber si las grabaciones habían sido alteradas: “Está claro que los clips han sido seleccionados y presentados sin ningún contexto”, apuntó.Conforme a los criterios deSaber más____________________________VIDEO RECOMENDADOAlemania supera el millón de contagios por coronavirus (AFP). TE PUEDE INTERESARLas implacables y detalladas instrucciones que dejó Enrique VIII de Inglaterra para la decapitación de Ana BolenaBolsonaro minimiza nuevamente la pandemia del coronavirus y pide enfrentarse con “el pecho abierto”Theodore McCarrick, el sacerdote pedófilo que se salió con la suyaJoe Biden agradece “enérgica y obsequiosa” bienvenida mundial tras su triunfo: “Estados Unidos ha vuelto”Biden dice que la negativa de Trump a conceder la derrota es “una vergüenza y no ayudará a su legado”Corte Suprema de EE.UU. insinúa que salvará la reforma sanitaria del Obamacare", Melania Trump presenta la decoración navideña de la Casa Blanca tras polémica | FOTOS,https://elcomercio.pe/mundo/eeuu/melania-trump-estados-unidos-esposa-de-donald-trump-presenta-la-decoracion-navidena-de-la-casa-blanca-tras-polemica-fotos-nndc-noticia/
"En el segundo día de protestas en Ica, trabajadores del sector agroexportación mantienen el bloqueo de la Panamericana Sur como medida de fuerza para exigir la derogatoria de la Ley de Promoción Agraria al señalar que recorta sus derechos laborales.MIRA: Ica: Panamericana Sur continúa bloqueada por manifestantes | FOTOS y VIDEOLos manifestantes exigen la presencia de altos miembros del Ejecutivo, entre ellos del ministro de Agricultura y Riego, Fernando Hurtado, para entablar una mesa de diálogo. Su principal pedido es la derogatoria del Decreto de Urgencia 043-2019, aprobada en diciembre del año pasado por el expresidente Martín Vizcarra, que extiende hasta el 2031 la vigencia de la ley de Promoción Agraria.“Hasta ahora ninguna autoridad se ha pronunciado ni se ha presentado aquí. Es indignante, queremos que esto se difunda a nivel nacional para que sepa el Presidente de la República y el Legislativo que Ica vive un momento crítico”, declaró a este Diario uno de los manifestantes que se encuentran ubicados a la altura del kilómetro 290 de la Panamericana Sur.Protestas en Ica: manifestantes exigen la presencia de altos mandos del Ejecutivo Los trabajadores denuncian que no cuentan con estabilidad laboral, seguros, compensación por tiempo de servicio y que las agroexportadoras les pagan de entre 35 y 39 soles por más de 12 horas laboradas. “El jornal en Arequipa es 70 soles, pero aquí las agroexportadoras se han puesto de acuerdo para pagar entre 35 a 39 soles”, agregó el manifestante.Protestas en Ica Esta mañana, la Presidencia del Consejo de Ministros (PCM) informó que una comitiva de alto nivel del Ejecutivo llegará hoy a la región para “establecer un espacio de diálogo y escuchar las demandas de los dirigentes agrarios”. La PCM precisó que la comitiva estará integrada por autoridades locales, del Minagri, MTPE, gobierno regional de Ica y la Defensoría del Pueblo.Las protestas se iniciaron durante la madrugada de ayer, cuando un grupo de trabajadores bloqueó tres tramos de la carretera Panamericana Sur, desde el sector El Álamo hasta la zona conocida como Expansión Urbana, en el distrito de Salas Guadalupe. En el transcurso del día, y ante la ausencia de autoridades, los manifestantes comenzaron a quemar llantas en medio de la carretera y se reportaron daños materiales en fundos cercanos. Sobre los desmanes, el Ministerio del Interior aclaró que la imagen de un bus incendiándose en la zona de protesta pertenecía a un hecho ocurrido en Piura en el año 2017.", Protestas en Ica: manifestantes exigen la presencia del Ministro de Agricultura,https://elcomercio.pe/peru/ica/protestas-en-ica-manifestantes-exigen-la-presencia-del-ministro-de-agricultura-noticia/
"Alejandro Sabella, subcampeón con la selección argentina en Brasil 2014, presenta complicaciones tras su internamiento por una arritmia en el Instituto Cardiovascular de la Ciudad de Buenos Aires.MIRA: Fixture, horarios y canales de los duelos de este martes en el torneo europeoSegún los principales medios deportivos argentinos, contrajo un virus intrahospitalario cuando su salud iba mejorando y esperaba volver a su hogar.Desde el entorno del extécnico de la ‘Albiceleste’ señalaron que su estado es delicado, pero no grave, y que está recibiendo antibióticos.#FuerzaSabella pic.twitter.com/WsLaMGwBQl— Selección Argentina 🇦🇷 (@Argentina) November 30, 2020 “Fuerza, Sabella”, señaló la selección argentina a través de redes sociales. “Toda la Familia Pincha está con vos”, agregó Estudiantes, y Juan Sebastián Verón, presidente del cuadro platense, no se quedó atrás: “Fuerza, maestro”, escribió.¡Toda la Familia Pincha está con vos! ✊🏼🇦🇹 #FuerzaSabella pic.twitter.com/drysdS6Y7F— Estudiantes de La Plata (@EdelpOficial) November 30, 2020
El técnico de 66 años, que ganó con Estudiantes la Copa Libertadores 2009 y la Liga argentina de 2010, dejó la selección argentina en 2014 y no volvió a dirigir desde entonces.MIRA: Cavani pidió disculpas por llamar “negrito” a un amigo: “Lo último que quiero es ofender a alguien”Familiares de Sabella detallaron días antes que le afectó mucho la muerte de Diego Armando Maradona y que fue internado para un chequeo exhaustivo porque es un paciente cardíaco.Como futbolista, ‘Pachorra’ jugó en River Plate, Estudiantes de La Plata, Shffield United (Inglaterra), Gremio (Brasil) y el Irapuato (México).Antes de comenzar su carrera como técnico fue entrenador asistente de Daniel Passarella en la selección argentina de 1994 a 1998 (estuvo en el Mundial de Francia 1998), en la selección uruguaya y en cuatro equipos: Parma, Monterrey, Corinthians y River Plate.Conforme a los criterios deSaber másMás en DT:Real Madrid confirmó la lesión de Eden Hazard y estaría fuera hasta cuatro semanasLalo Maradona, hermano de Diego: “Te pido que abraces a mamá y papá y no los sueltes”Barcelona vs. Osasuna: Messi anotó golazo y se lo dedicó a Maradona con un especial gesto | VIDEOLa confesión de Messi a Maxi Rodríguez por el homenaje a Maradona con la camiseta de Newell’sVideo recomendado:Fútbol Internacional: Lionel Messi y su confesión sobre el homenaje a Maradona | VIDEO ", Alejandro Sabella se encuentra delicado de salud tras internamiento ,https://elcomercio.pe/deporte-total/futbol-mundial/alejandro-sabella-se-encuentra-delicado-de-salud-tras-internamiento-seleccion-argentina-nczd-noticia/
"Clima en Lima | El Servicio Nacional de Meteorología e Hidrología del Perú (Senamhi) pronosticó que la temperatura mínima en Lima Este será de 16°C para hoy martes 1 de diciembre del 2020.MIRA AQUÍ: Metropolitano: estas son las estaciones y los horarios de los servicios expresos que funcionarán desde el martesSegún la entidad del Ministerio del Ambiente (Minam), la temperatura máxima será de 26°C. Además, indicó que se espera cielo nublado en las primeras horas de la mañana, variando a cielo con nubes dispersas hacia el mediodía y cielo nublado al atardecer. Se presentaría lluvia ligera.En Lima Oeste, la temperatura máxima llegaría a 23°C, mientras que la mínima sería de 17°C. Se pronostica cielo nublado en las primeras horas de la mañana, variando a cielo con nubes dispersas hacia el mediodía y con tendencia a cielo nublado por la tarde. Habría lluvia ligera.MIRA AQUÍ: Mininter aclaró que no se desactivará Grupo Terna de la PNP tras expresiones de viceministroTemperaturas normales en primaveraEl Senamhi informó que el martes 22 de setiembre a las 8:30 a. m. inició la primavera. La institución del Ministerio del Ambiente indicó en un comunicado que se esperan temperaturas del aire ligeramente frías a normales en la franja costera con presencia de días soleados, cuya frecuencia se incrementará hacia mediados de la estación.Precisó que persistirán condiciones nubosas y no se descartan ocasionales lloviznas.La estación durará hasta el 21 de diciembre a las 05:02 horas.MIRA AQUÍ: Subcomandante general de la PNP renuncia al cargo en medio de una crisis en la institución“En Lima Metropolitana, se estima que las temperaturas del aire oscilarán, entre normales a ligeramente frías durante el día y la noche, con valores promedio entre 14 y 25 grados Celsius”, se lee en el comunicado de Senamhi.Conforme a los criterios deSaber másVIDEO RECOMENDADOLos principales anuncios del presidente Sagasti Francisco Sagasti: Conoce cuáles fueron los principales anuncios del presidente "," Clima en Lima: se espera una temperatura mínima de 16°C, hoy martes 1 de diciembre, según el Senamhi",https://elcomercio.pe/lima/sucesos/clima-en-lima-se-espera-una-temperatura-minima-de-16c-hoy-martes-1-de-diciembre-segun-el-senamhi-nndc-noticia/
"Lionel Messi se quedó fuera de la lista de convocados para el Barcelona vs. Ferencváros por la quinta jornada de la Champions League. El argentino se quedará en España al igual que Marc-André ter Stegen y Philippe Coutinho, ambos habituales titulares en el conjunto comandado por Ronald Koeman.MIRA: Lionel Messi y la primera vez que fue campeón con la camiseta de Newell’s Old BoysEs la segunda vez que el capitán azulgrana se perderá un compromiso por la Liga de Campeones. La semana pasada, el ’10′ tampoco viajó a Ucrania para medirse a Dinamo Kiev. Ahora, el técnico decidió que la máxima figura del plantel no forme parte de la nómina que se desplazará a Budapest, Hungría.Messi, Coutinho y Ter Stegen no fueron elegido por decisión técnica. Mientras que Gerard Piqué,Ronald Araujo, Samuel Umtiti, Sergi Roberto y Ansu Fati todavía permanecen en proceso de recuperación por diversas lesiones que les impiden participar de los partidos de Barcelona en todos los torneos.Koeman llamó a los guardametas Iñaki Peña y Arnau Tenas, quienes serán el recambio de Neto Mutara. El defensor Óscar Mingueza, también del equipo filial, puede seguir en el once titular de Barcelona. Asimismo, el extremo Konrad de la Fuente tendría chances de sumar más minutos en el primer equipo.Frenkie de Jong, a diferencia del choque anterior en Ucrania, se perfila como titular en Hungría. Sergio Busquets, que se recuperó de una lesión, apunta a sumar más minutos. Matheus Fernandes, debutante en la jornada pasada de la Champions League, seguirá en la lista de 20.Barcelona vs. Ferencváros: la convocatoria de los azulgranasDest, Busquets, Aleñá, Griezmann, Pjanic, Braithwaite, Dembelé, Riqui Puig, Neto, Lenglet, Pedri, Trincao, Jordi Alba, Matheus Fernandes, De Jong, Junior Firpo, Iñaki Peña, Óscar Migueza, Konrad y Arnau Tenas.🗒️ CONVOCATORIA✈️ #FerencvarosBarça pic.twitter.com/lYl0EUOON5— FC Barcelona (@FCBarcelona_es) December 1, 2020 Conforme a los criterios deSaber másMÁS EN DT...Stéphanie Frappart se convertirá en la primera mujer en dirigir en Champions LeagueChampions League: fixture, horarios y canales de los duelos de HOY martes en el torneo europeoLewis Hamilton dio positivo a la prueba del coronavirus y no estará en el Gran Premio de SakhirCavani pidió disculpas por llamar “negrito” a un amigo: “Lo último que quiero es ofender a alguien”Lalo Maradona, hermano de Diego: “Te pido que abraces a mamá y papá y no los sueltes”NO DEJES DE VERFútbol Internacional: Lionel Messi y su confesión sobre el homenaje a Maradona | VIDEO ", Lionel Messi fuera de la convocatoria para Champions League por segunda vez consecutiva,https://elcomercio.pe/deporte-total/champions-league/barcelona-vs-ferencvaros-lionel-messi-fuera-de-la-convocatoria-para-champions-league-por-segunda-vez-consecutiva-nczd-noticia/
